title,media
Pete Buttigieg officially announces presidential campaign,"South Bend, Indiana (CNN) South Bend Mayor Pete Buttigieg officially launched his presidential campaign on Sunday, formally vaulting the Midwestern ..."
Mayor Pete Buttigieg is the hottest thing in politics. Can it last?,"Pete Buttigieg was home recently, back in the Indiana city where he was born and serves as mayor. He was at the library on Main Street, at a book signing for his ..."
Pete Buttigieg: What you need to know about the presidential hopeful,"Since announcing in January that he was launching a presidential exploratory committee, South Bend Mayor Pete Buttigieg gone from from a longshot with a ..."
2020 hopeful Pete Buttigieg says he and husband planning to have a child soon,"Democratic presidential hopeful Pete Buttigieg announced that he and his husband are planning to have a child soon. Buttigieg, the mayor of South Bend, ..."
"Who Is Pete Buttigeig, the Gay Millennial Mayor the Democrats Didn’t See Coming?","Inquiring minds want to know: Who is Pete Buttigeig? Before the lead-up to the 2020 Democratic primary began, it was widely anticipated that Texas senatorial ..."
"Before he was a candidate, Pete Buttigieg was voted 'most likely' to be president","Democratic presidential candidate Pete Buttigieg may have a leg up on his competition in 2020. In South Bend, Indiana, Buttigieg is nearly universally known ..."
Rivals are scrambling to dig up dirt on Pete Buttigieg,"SOUTH BEND, Ind. — Caught off guard by his sudden surge, Pete Buttigieg's rivals are scrambling to find vulnerabilities and lines of attack that can be used ..."
"Democratic 2020 contender Pete Buttigieg will return donations from lobbyists, campaign says","Democratic presidential contender Pete Buttigieg, the mayor of South Bend, Indiana, will return thousands of dollars donated to his campaign by registered ..."
Presidential candidate Pete Buttigieg says the monthly mortgage payment on his 'one house in Indiana' is $450,In his time on the campaign trail 37-year-old presidential candidate Pete Buttigieg has emphasized his Midwestern roots. One aspect of that Midwestern lifestyle ...
‘Pete! Pete! Pete!’ Buttigieg fever hits New Hampshire – can he keep up the pace?,"In Manchester and Concord the mayor of South Bend, Indiana, shone again as a persuasive centrist in a party moving left. Adam Gabbatt in Manchester, New ..."
How Pete Buttigieg Is Shaking Up the 2020 Race,Can a 37-year-old Indiana mayor capture the White House? Nathan Heller checks in with Pete Buttigieg's suddenly not-so-long-shot campaign.
"Pete Buttigieg on faith, his marriage and Mike Pence","In a Q&A with Father Edward Beck, the South Bend, Indiana, mayor discusses his views on the morality of military *service*, abortion, love, marriage and being ..."
Pete Buttigieg officially launches 2020 presidential campaign,"South Bend, Ind. Mayor Pete Buttigieg, a rising star in the large pool of Democratic presidential hopefuls, officially announced a 2020 presidential bid on Sunday ..."
Pete Buttigieg raises $1 million within four hours of 2020 campaign announcement,"Buttigieg also has used his campaign funds more sparingly than rivals, according to a recent filing from the Federal Election Commission."
"Pete Buttigieg's not-so-secret weapon is his husband, Chasten","There are now 17 hopefuls vying for the Democratic vote to become President of the United States, but there's only one whose spouse has become a talker."
2020 candidate Pete Buttigieg speaks French in message on Notre Dame - Business Insider,"Democratic presidential candidate Pete Buttigieg, who's multilingual, offered his condolences in French, following a massive fire at the historic Notre Dame ..."
Buttigieg officially announces presidential campaign,"South Bend, Indiana, Mayor Pete Buttigieg officially announces his presidential campaign."
Pete Buttigieg suggests national service program,Democratic presidential candidate Pete Buttigieg on Monday night advocated a form of national public *service* for all young adults as a way to create unity ...
Pete Buttigieg’s Focus: Storytelling First. Policy Details Later.,"In his writings as a student and young politician, he fixated on the kind of media narratives that have propelled his 2020 campaign."
Is Pete Buttigieg a Transformational Candidate?,One of the reasons I thought Donald Trump would win in 2016 was not just that he was focusing on the core issues roiling the middle classes (immigration and ...
Pete Buttigieg: How the presidential underdog revitalized South Bend,"South Bend mayor Pete Buttigieg, and his underdog campaign for the 2020 Democratic nomination for president, gets noticed quite a bit these days. He's fluent ..."
Buttigieg: 'I would stack up my experience against anybody',"South Bend Mayor Pete Buttigieg defended his lack of executive experience Sunday, arguing that voters should look at the “quality, as well as quantity."""
Pete Buttigieg’s plan to make governing great again,The most important debate in the Democratic primary is over how change happens.
"Which Way, Pete Buttigieg?",Can the heartland meritocrat be a traitor to his class?
Pete Buttigieg targeted in operation by right-wing provocateur Jacob Wohl,WASHINGTON — A young Michigan man claims he became an unwitting participant in a plot by right-wing provocateurs Jacob Wohl and Jack Burkman to ...
"In New Hampshire, many older Democrats see Pete Buttigieg's age as an asset","Concord, N.H. — It was, in some ways, an incongruous scene: Pete Buttigieg, the 37-year-old Democratic presidential hopeful running on a message of ..."
Pete Buttigieg is pro-Israel when Democrats are increasingly critical,"Pete Buttigieg may be a rising star in the 2020 Democratic field, but his strong pro-Israel views may put him at odds with the increasingly pro-Palestinian left flank ..."
The breakout star of Pete Buttigieg’s 2020 campaign? His husband Chasten,Chasten Buttigieg has gained a sizable following – and boosted his husband's campaign – with his candid social media posts about life on the trail.
Buttigieg pledges to 'do better' at building more diverse following,"Washington (CNN) 2020 Democratic presidential candidate Pete Buttigieg pledged on Tuesday to do more to reach out to African-American voters, laying out ..."
Inside Pete Buttigieg's plan to revitalize his city,"Mayor Pete Buttigieg pushed an aggressive plan to revitalize South Bend, Indiana, when he took charge in 2012. CNN's Vanessa Yurkevich has more."
Get to know 2020 candidate Pete Buttigieg in nine clips – video,"The 37-year-old mayor of South Bend, Indiana officially launched his run for the White House on Sunday - get to know this 2020 candidate in nine clips."
LGBTQ donors help Pete Buttigieg defy 2020 expectations,"Lesbian, gay, bisexual, transgender and queer donors have helped ""Mayor Pete"" raise more than $7 million in just over two months."
Pete Buttigieg’s Language Magic Is Textbook Polyglot Mythmaking,American culture is far from the first to glorify people who speak several languages.
A Look At How Pete Buttigieg Is Reaching Out To Voters,"Many Democrats are focused on winning back white, working-class voters. South Bend, Ind., Mayor Pete Buttigieg, an emerging 2020 candidate, has been ..."
New polls in Iowa and New Hampshire show Pete Buttigieg on the rise,WASHINGTON (CNN) Two new polls from the states that will be the first to weigh in on the Democratic field next year show former Vice President Joe Biden and ...
Mayor Pete Buttigieg officially enters 2020 presidential race,"South Bend Mayor Pete Buttigieg announced that he's officially running for president, topping off a week of heightened media attention."
Pete Buttigieg expected to formally announce 2020 presidential run,"Pete Buttigieg, the 37-year-old openly gay mayor of South Bend, Indiana, who is shaking up the Democratic presidential race with his potential plans to run, ..."
The 'weird parallels' between Vice President Mike Pence and presidential hopeful Pete Buttigieg,"While Vice President Mike Pence and presidential hopeful Pete Buttigieg are at odds on many issues, they also have many things in common."
Buttigieg explains controversy surrounding taped calls,"Mayor Pete Buttigieg explains why he asked Police Chief Darryl Boykins, who is black, to resign after a controversy surrounding secret phone recordings while ..."
"Buttigieg makes new effort to talk race, reach black voters","NEW YORK (AP) — From lunch with a civil rights leader in Harlem to meetings at a historically black university in South Carolina, Democratic presidential ..."
4 Marketing Lessons From 'Mayor Pete' Buttigieg,"Mayor Pete Buttigieg, the 37-year-old openly gay mayor of South Bend, Indiana with a hard-to-pronounce last name (according to his Twitter profile, ..."
'A kind of war': Buttigieg describes struggle with sexual orientation in emotional speech,Pete Buttigieg on Sunday delved publicly and intimately into his struggle with his own sexuality in a way no other serious presidential candidate has.
Buttigieg record with black South Bend residents under spotlight. 'He's got some work to do.',"Heightened scrutiny of his decisions, controversies in South Bend."
Why Pete Buttigieg may be reviving progressive ideals of the Social Gospel Movement,"Pete Buttigieg's recent comments on Christian values, have drawn much attention. They might be quite similar to the ideals espoused by the Midwestern ..."
Oprah gives Pete Buttigieg a new name while weighing which candidate to support,Oprah Winfrey thinks Mayor Pete Buttigieg's name could help him. But the pronunciation seems to trip her up.
"Pete Buttigieg says Bernie Sanders may lack the ""novelty"" to win in 2020","South Bend, Indiana, Mayor Pete Buttigieg said in an interview with the New York Times that ""people were refreshed by the novelty"" of the progressive proposals ..."
Pete Buttigieg Just Had One Hell of a Week,"Less than a minute after sitting down with South Bend Mayor Pete Buttigieg, Ellen DeGeneres gave voice to the obvious. “It's happening fast, right?” she said, of ..."
Mayor Pete Buttigieg on a religious left revival,Toluse Olorunnipa on the staffing turmoil within the Department of Homeland Security. Sarah Pulliam Bailey on likely presidential candidate Pete Buttigieg's faith ...
Buttigieg addresses demoting city's black police chief,"At a CNN Town Hall, 2020 Democratic presidential candidate Mayor Pete Buttigieg addresses his controversial decision to demote South Bend, Indiana's first ..."
Pete Buttigieg wants the FTC to fight big tech monopolies,"During his CNN town hall event last night in New Hampshire, 2020 Democratic candidate Pete Buttigieg said that, if elected president, he would work to ..."
"Vogue can make anyone look glamorous, including Pete Buttigieg",Pete Buttigieg is having his Vogue moment. And Vogue has not let him down. The 37-year-old presidential candidate is featured in the June issue of the fashion ...
Religious conservatives grapple with how to respond to Buttigieg,"Religious conservatives are faced with a new challenge in responding to Pete Buttigieg, a Democratic candidate who is leaning into discussions on faith."
Trump on 'Hannity': 'I'm rooting for' South Bend Mayor Pete Buttigieg,"Trump offered thoughts on several of his potential Democratic challengers for 2020, including South Bend Mayor Pete Buttigieg."
Presidential hopeful Pete Buttigieg’s unlikely link with Bernie Sanders,"Presidential aspirant Pete Buttigieg speaks to the press at Gibson's Bookstore in Concord, N.H. Photo by Kevin O'Connor/VTDigger. CONCORD, N.H. — Two ..."
2020 candidate Pete Buttigieg responds to anti-gay heckler at Iowa rally – video,"Pete Buttigieg, the mayor of South Bend, Indiana, and Democratic presidential candidate, was heckled by a protester at a rally in Des Moines, Iowa. The person ..."
Buttigieg pressed on why he doesn't have policy proposals,"During a town hall, CNN's Anderson Cooper questions Democratic presidential candidate Pete Buttigieg on why his campaign website has no policy page."
"Buttigieg will no longer accept donations from lobbyists, returns $30,250 contributions","Pete Buttigieg announced Friday that his campaign will no longer accept donations from registered lobbyists and will return over $30,000 in donations."
Buttigieg rises in polls as husband's popularity grows,Presidential candidate Pete Buttigieg is rising in the 2020 polls and his husband Chasten's popularity grows. CNN's Kate Bennett reports.
"With eyes on the presidency, Mayor Pete seeks a 'generational alliance' to tackle climate change","Pete Buttigieg, the 37-year-old Democratic mayor of South Bend, Indiana, is riding a wave of media attention as he campaigns to be the next United States ..."
What Happened When Pete Buttigieg Tore Down Houses In Black And Latino South Bend,"""Everyone wants to find a villain,"" a South Bend politician said of Mayor Pete Buttigieg's housing program. ""This is just how economic development happens."""
Buttigieg: I wouldn't be running if I hadn't come out,Mayor Pete Buttigieg discusses with CNN's Anderson Cooper how he thinks his life would've been different if he had come out sooner.
"Buttigieg, Race, and an 'All Lives Matter' Speech","After a speech surfaced with Pete Buttigieg saying ""All Lives Matter"" in 2015, racial issues in the South Bend police department, and Buttigieg's role in them, are ..."
Pete Buttigieg wants a national service program. Could it heal a divided country?,"Democratic 2020 presidential candidate Pete Buttigieg says a national *service* program for young adults could help ""social cohesion."" Not all agree."
"Buttigieg Lays Out Agenda For Black America, Explains 'All Lives Matter' Comment",The 2020 Democratic candidate and mayor of a majority-white Indiana city has gone on urban radio and spoke to a major civil rights group and has addressed ...
Obama Alumni for Buttigieg,"Susan Rice, Jay Carney and Stephanie Cutter are among Buttigieg's early donors."
Democratic presidential candidate Pete Buttigieg schedules first Richmond visit; Beto O'Rourke is in Short Pump on Tuesday,"Democratic presidential candidate Pete Buttigieg, the mayor of South Bend, Ind., will visit Richmond on June 15."
Warren's the professor and Buttigieg is the charismatic student without his homework. Guess who voters like best?,"Washington (CNN) There were five Democratic candidates, back-to-back on the same stage at CNN's epic youth-centered town hall in New Hampshire, and all ..."
"Pete Buttigieg remembers Richard Lugar: 'A great mayor, senator and mentor'",Presidential candidate Pete Buttigieg says fellow Hoosier and former Sen. Dick Lugar was a mentor.
Watch live: Pete Buttigieg officially announces presidential campaign | TheHill,"South Bend, Ind., Mayor Pete Buttigieg will officially announce his run for president in his home state Sunday at 2 p.m.."
Democrats Have to Decide Whether Faith Is an Asset for 2020,"The religious left has gotten giddy about South Bend Mayor Pete Buttigieg, but campaign infrastructure and policy matter more than rhetoric."
Q&A: Pete Buttigieg digs Phish and Radiohead — but don't expect them at his inauguration,"Presidential candidate Pete Buttigieg defends his very millennial music taste, from his love of Dave Matthews jams to his preference for the difficult Radiohead ..."
How Astonishing Is Mayor Pete’s Rise?,"Buttigieg has come a long way in a short time. But he has much, much further to go to catch up with the front-runners."
"'You only get to be one person': Buttigieg, Maddow on coming out, weight of 'the closet'",MSNBC host Rachel Maddow and 2020 Democratic presidential hopeful Pete Buttigieg have a frank discussion about life in the closet and coming out as gay.
Seeing plenty that could be presidential in Indiana's Pete Buttigieg,"A breath of *fresh* air. Currently, our country is led by a man a questionable intellect, questionable moral character with a tenuous grasp of the English language."
"Watch: In Boston, Pete Buttigieg Calls For New Generation Of Leadership","During an interview with Boston Public Radio, the South Bend Mayor said he's been pleasantly surprised at the success of his campaign."
Presidential candidate Pete Buttigieg returns to New Hampshire,"South Bend, IN mayor speaks at event at Currier Museum."
"Buttigieg on Trump official's 'hate hoax' criticism: 'I'm not a master fisherman, but I know bait when I see it'","Pete Buttigieg refused to engage when asked about a Trump administration official who accused him of pushing a ""hate hoax"" during a back and forth with Vice ..."
An 18-year-old Pete Buttigieg won a JFK Library essay contest. His subject was Bernie Sanders.,"Nearly two decades ago, an Indiana high school student won a national award from the John F. Kennedy Library for his essay about a little-known Vermont ..."
No one had ever heard of 'Mayor Pete.' Why's he so popular now? [Opinion],Buttigieg's recent surge suggests that some Democrats are sick of the moral melodrama and want a candidate who is more about governing than grandstanding ...
"Buttigieg Talks Charter Schools, Warns “Free” College Is Less Progressive Than It Sounds – Education Next","The mayor of South Bend, Indiana, Pete Buttigieg, says charter schools “have a place” as “a laboratory for techniques that can be replicated.” Buttigieg, who is ..."
Pete Buttigieg Sets L.A. Fundraiser Hosted By Ryan Murphy,The presidential candidacy of Pete Buttigieg has generated excitement among Hollywood's gay A-listers along with an outpouring of those ready to open their ...
Davich: Pete Buttigieg's public kiss reflects much more than another political photo op,"When I watched South Bend Mayor Pete Buttigieg embrace and kiss his husband, Chasten Buttigieg, I was genuinely touched."
Pete Buttigieg and Beto O’Rourke Stake Out Similar Turf in a Crowded Field,"As the presidential nominating contest narrows next year, there may not be room for two white men under 50 who present themselves as mainstream ..."
Democratic hopefuls could learn from Bernie Sanders and Pete Buttigieg | TheHill,"Longtime scholar Dan Nimmo, whose research has contributed to the disciplines of political science, journalism, and communication, was one of the first to ..."
Pete Buttigieg Sets L.A. Fundraiser Hosted by Gay Hollywood A-List (Exclusive),The Hollywood Reporter has learned that plans are underway for what will most certainly be Democratic presidential candidate Pete Buttigieg's most high-profile ...
"Buttigieg, Fox News in talks on town hall | TheHill","Democratic presidential candidate Pete Buttigieg is in talks with Fox News about appearing in a town hall event on the network, a campaign spokesperson told ..."
"If Pete Buttigieg’s face is his message, it’s not yet complete","The 37-year-old mayor is rising in the presidential polls — but will youth, a great résumé and phrases such as “we need generational change” be enough?"
"Joe Biden, Pete Buttigieg see both good and bad news in latest Quinnipiac Poll",WASHINGTON – A new presidential poll has both good and bad news for Democratic hopefuls Joe Biden and Pete Buttigieg. A majority of Democratic voters ...
Silver Bulletpoints: We’ve Got Your Backlash To The Buttigieg Backlash,Welcome to the first edition of … [taps microphone and grins sheepishly] … Silver Bulletpoints. You don't want to know how much time we spent workshopping ...
Buttigieg is a symbol for a rising Christian left,"Erick Erickson's comments about Pete Buttigieg represent the fear by some on the Christian right of an incipient and growing progressive Christian movement, ..."
Behind the media's fascination with Mayor Pete Buttigieg,"Olivia Nuzzi, who just wrote a NYMag cover story about Mayor Pete Buttigieg, says the candidate is benefiting from being so available for interviews: ""Nobody ..."
Opinion: Buttigieg confused about meaning of freedom,"""Buttigieg's remarks confuse freedom with the power to do or to have whatever one desires."""
Things Stacey Abrams and Pete Buttigieg get that most other pols don’t,"Stacey Abrams is an African American woman, of “sturdy build” she says, from the South who barely lost the Georgia governor's race, has made voting rights her ..."
Pete Buttigieg: God does not have a political party,"Pete Buttigieg opened up about his faith during a CNN town hall, expressing confidence that he will be able to unite many different groups of people because ..."
Buttigieg on Pence: My quarrel is with this ...,"Democratic presidential candidate Mayor Pete Buttigieg says his faith influences the way he sees the politics, and explains why it conflicts with Vice President ..."
Buttigieg explains how he'd campaign against Trump,Democratic presidential candidate Pete Buttigieg discusses how he would take on President Trump if he were to secure the Democratic nomination in 2020.
Pete Buttigieg Offers America Double Relief,He can deliver us from a scandal-plagued presidency and transform the relationship between gay and straight America.
"Gwyneth Paltrow, Bradley Whitford Among Co-Hosts for Pete Buttigieg’s Next L.A. Fundraising Swing","Pete Buttigieg, the mayor of South Bend, Ind., is making a big push for Los Angeles campaign cash next month."
2020 candidate Pete Buttigieg joins Stop & Shop workers in Malden,"The 2020 Democratic presidential candidate known as ""Mayor Pete"" joined striking Stop and Shop workers in Malden Friday."
Buttigieg clarifies comparison of Trump-Sanders voters,"During a CNN town hall, South Bend, Indiana, Mayor Pete Buttigieg clarified comments he made comparing supporters of President Trump and Sen. Bernie ..."
"Mayor Pete Buttigieg's Unlikely, Untested, Unprecedented Presidential Campaign","He's running as a healer, not a fighter—but 'Mayor Pete' Buttigieg has become the first breakout candidate of the 2020 Democratic primary."
South Bend Mayor Pete Buttigieg out of town for nearly half the days in recent months,"SOUTH BEND — From Austin, Texas, to West Hollywood, Calif., South Bend Mayor Pete Buttigieg's presidential bid has taken him out of town nearly half of the ..."
"Democratic Presidential Candidate Pete Buttigieg On Trade, Military Force And More","In a wide-ranging interview with NPR, presidential hopeful Mayor Pete Buttigieg answers questions about everything from trade and the use of military force to ..."
'Seniors for Buttigieg': Why voters twice his age feel drawn to the millennial mayor,"When Barbara Paulding was 44 years old, Joe Biden had been a member of the United States Senate from Delaware for more than a decade -- and Pete ..."
Mayor Pete Buttigieg asks for help diversifying his base,"At a high school in North Charleston, South Carolina, Democratic presidential candidate Pete Buttigieg made an unusual pitch to voters. He asked the mostly ..."
Pete Buttigieg: Presidential candidate posts positions on 27 issues,"Democratic presidential hopeful Pete Buttigieg is seemingly everywhere these days — the pages of your local newspaper, on the radio, on TV, even on late ..."
Pete Buttigieg says he wants to 'live a life that's worthy' of fellow service members,"Calling Memorial Day ""a day beyond politics,"" Democratic presidential candidate Pete Buttigieg on Monday reflected on the holiday's meaning and paid tribute ..."
"Where Pete Buttigieg stands on the issues, from 'Medicare for all' to gun control","Mayor Pete policies come to light as the South Bend mayor rises in fame. Here's where Pete Buttigieg stands on abortion, healthcare, taxes and more."
Pete Buttigieg's campaign asset: 'Do I have a great husband or what?',"Democratic presidential candidate Pete Buttigieg's husband, Chasten Buttigieg, is becoming a star in his own right — complete with 322000 very active Twitter ..."
Mayor Buttigieg Is Working Remotely Today,The rising 2020 contender is meeting powerful donors and charming the coastal media. But what about his day job back in South Bend?
Pete Buttigieg goes to Hollywood in latest presidential bid plot twist,Mayor Pete Buttigieg's storyline is one some showbusiness movers and shakers appear to be closely following.
"Buttigieg wields his military credentials: 'It's not like I killed Bin Laden,' but it was dangerous",Chicago (CNN) Pete Buttigieg wields his military *service* as both a sword and a shield in his race for the White House. Whether he's reassuring voters about his ...
Pete Buttigieg: Here's how the tougher rules for the later 2020 Democratic debates affect Mayor Pete,"It's will be harder to qualify for the third and fourth 2020 Democratic presidential debates, but South Bend Mayor Pete Buttigieg looks like he will."
Buttigieg pushes for massive fundraising haul to cement top-tier status,"Pete Buttigieg is aiming to shake the Democratic presidential race with a massive fundraising total this quarter, staking his claim in the top tier of the primary and ..."
Pete Buttigieg Is Inspiring Us To Come Out — Again,"This week, South Bend, Indiana Mayor Pete Buttigieg and his husband, Chasten, appeared on the front cover of Time magazine with the headline “First Family."
President Pete? One-on-One With Buttigieg,An interview with Mayor Pete Buttigieg of South Bend on his 2020 presidential campaign.
Pete Buttigieg warns Democrats against using 'identity politics' - Business Insider,"Mayor Pete Buttigieg of South Bend, Indiana, called for unity and rebuked his own political party for using ""identity politics"" to divide Americans during a speech ..."
"Buttigieg campaign, brimming with cash, staffs up","South Bend Mayor Pete Buttigieg's campaign has come a long way from its humble roots. Over the past few weeks, Buttigieg has brought on a host of new ..."
