title,media
Centrist-child syndrome,Two of the Democratic party's most proudly moderate candidates seem to still be rebelling against their Marxist dads.
Pete Buttigieg unveils health care plan,"2020 Democratic presidential candidate Pete Buttigieg unveiled his health care plan on Thursday, outlining a middle-of-the-road approach, according to new ..."
Pete Buttigieg to speak at Indianapolis' NAACP Freedom Fund Banquet on Friday,Presidential candidate and South Bend Mayor Pete Buttigieg will be making his way to Indianapolis on Friday to speak at the Greater Indianapolis NAACP 50th ...
I spent a decade addicted to opioids: Here's why Pete Buttigieg gives me hope | TheHill,"For years, I've been shouting from the rooftops to get policymakers to include people in recovery in their decision-making processes. Finally, I feel like our voices ..."
Pete Buttigieg's husband Chasten weighs in after Trump aide touts Pence's meeting with Irish PM and partner,"Particularly pointed criticism came from Chasten Buttigieg, the husband of presidential candidate and South Bend, Ind., Mayor Pete Buttigieg."
Pete Buttigieg Opening Indianola Office,Democratic Presidential Candidate Pete Buttigieg is opening up a campaign office in Indianola tomorrow. The office is located at 1709 N Jefferson Way Suite ...
Primary Source: Buttigieg lands Lebanon endorsements,Look for a number of Democratic presidential candidates to flock to Manchester this weekend for some face time with party officials and activists at the New ...
Lights Go Out on Pete Buttigieg,WATCH: @PeteButtigieg's supporters pulled out their phones to light the stage after the power went out at a campaign event in northern Nevada (Source: ...
Buttigieg office to open in Council Bluffs Sunday,Presidential campaign representatives for Mayor Pete Buttigieg will open an office in Council Bluffs Sunday.
Pete Buttigieg: Where He Stands,"""Mayor Pete,"" the youngest contender in the Democratic field, celebrates his age."
Pete Buttigieg gets aggressive as he looks to break out of the middle,"Las Vegas (CNN) Pete Buttigieg is done waiting. After rising from relative obscurity earlier this year, the South Bend, Indiana, mayor has found his campaign ..."
Pete Buttigieg raises $19.1 million in the third quarter,"The haul is less than the sum Buttigieg raised in the previous quarter, but is still expected to be among the heftiest totals raised by any of the candidates vying for ..."
Dem. Pete Buttigieg responds to viral video of county commissioner targeting his sexuality,"NASHUA, N.H (WHDH) - While on a campaign swing through New Hampshire, Democratic presidential candidate Pete Buttigieg is bringing attention to his ..."
"Can Pete Buttigieg, cool and cerebral, connect with voters?","WATERLOO, Iowa (AP) — John McAnear, a 77-year-old Air Force veteran, stood in an audience of hundreds in suburban Des Moines with an oxygen tank at his ..."
Pete Buttigieg is punching above his weight,"You have to give South Bend, Ind., Mayor Pete Buttigieg credit. The youngest candidate in the Democratic field, the one with no civilian experience above the ..."
Democratic debate: Here's why pundits are praising Pete Buttigieg's performance in Ohio,"With 12 Democratic presidential candidates on stage, Tuesday night's debate from Otterbein University in Westerville, Ohio, was the biggest primary debate in ..."
Pete Buttigieg's women's rights agenda includes nominating a cabinet that's 50% women,"South Bend, Indiana, Mayor Pete Buttigieg released a 26-page women's rights agenda that outlines how he will make women's advancement inside and outside ..."
The Agonizing Imperfection of Pete Buttigieg,So talented yet so vulnerable — like all the leading contenders for the Democratic nomination.
‘I Don’t Need Lessons From You on Courage’: Pete Buttigieg Makes His Case,"On the Democratic debate stage Tuesday night, Mr. Buttigieg didn't brag about his military *service*, but he did outflank his rivals."
Pete for Corporate America,Pete Buttigieg isn't pivoting. He's the same kind of politician he's always been: A technocratic liberal.
"Flush With Cash, Pete Buttigieg Bets His Campaign on a Breakthrough in Iowa",The Midwest mayor is making an appeal to rural voters and hoping a massive ground game delivers a top-tier caucus finish.
"Pete Buttigieg Talks Impeachment, Health Care, and the Political Spectrum",The Democratic Presidential candidate spoke with David Remnick onstage at the New Yorker Festival.
Pete Buttigieg Is Still Fighting the Last War,"It's Pete Buttigieg's moment. Again. His combative performance at the most recent debate, coupled with the release of a few polls suggesting he's entered the top ..."
Pete Buttigieg riding high after last debate,Democratic presidential candidate Pete Buttigieg finds himself riding high after he took a more aggressive tone in the CNN/New York Times debate.
"Warren, Biden, and Sanders supporters really aren’t fans of Pete Buttigieg - Business Insider","Supporters of the three Democratic frontrunners all dislike Pete Buttigieg more than the typical Democrat does, according to Insider's latest polls."
"Pete Buttigieg Says 2020 Election Is a ""Moment That Calls for Someone Like Me""",Mayor Pete Buttigieg was greeted with a rapturous standing ovation when he took the stage at the New Yorker Festival on Saturday afternoon. Then a ...
Buttigieg opens new presidential campaign office in South Bend,"SOUTH BEND, Ind. (WNDU) - South Bend Mayor Pete Buttigieg was back in South Bend Thursday. This time, he unveiled his new campaign office at 218 ..."
Joe Biden calls Pete Buttigieg 'a good man' for defending the Biden family,Former Vice President Joe Biden had some words of praise for fellow Democratic presidential contender Pete Buttigieg at an Iowa labor forum on Sunday.
Democrat Buttigieg used marijuana 'a handful of times',"LAS VEGAS (AP) — Democratic presidential candidate Pete Buttigieg said Wednesday that he's used marijuana ""a handful of times a long time ago,"" and that it's ..."
Pete Buttigieg reports $19.1 million fundraising haul in third quarter,Pete Buttigieg continues to raise the money he'll need to stay in the race as he tries to break into the top tier of Democratic presidential candidates.
"Analysis: Pete Buttigieg drives a Chevy Cruze, and other Ohio debate takeaways","WESTERVILLE, Ohio — Pete Buttigieg, the presidential hopeful and Indiana mayor, revealed something new about his whip at Tuesday's Democratic debate."
"Pete Buttigieg pitches himself as alternative to Bernie Sanders, Elizabeth Warren in New Hampshire","NEW LONDON, N.H. — Democrat Pete Buttigieg is testing the limits of neighborly goodwill in the Granite State — doubling down on his pitch as the bold but ..."
The Note: Buttigieg takes hold in center of 2020 field,"Mayor Pete Buttigieg has found himself in the middle of several overlapping conversations. For a candidate billing himself as middle-of-the-country centrist, that's ..."
Pete Buttigieg took a dig at Elizabeth Warren’s small-donation fundraising strategy,"Last week, Sen. Elizabeth Warren announced that her pledge to forgo traditional big-money fundraisers during the Democratic primary race would extend ..."
Pete Buttigieg defuses protesters as 2020 candidates bring campaign to LGBT forum,Democratic presidential candidates brought their campaigns to Los Angeles on Thursday night for a town hall focused on LGBTQ issues.
Why Zuckerberg’s Embrace of Mayor Pete Should Worry You,Some in Silicon Valley see the technocratic wonder boy from South Bend as a safe alternative to the big-tech crackdown promised by Elizabeth Warren.
Pete Buttigieg Reflects on His Coming Out Story—and How It Inspired His LGBTQ+ Rights Plan,"In an exclusive for OprahMg.com, for National Coming Out Day, 2020 Democratic presidential hopeful Pete Buttigieg revisits his coming out story and ""Becoming ..."
"As Pete Buttigieg Courts Black Voters, His Sexuality Is a Hurdle for Some",A Buttigieg campaign memo that surfaced last week suggested “being gay was a barrier” to support from some black voters in South Carolina.
"Pete Buttigieg is a presidential longshot. If he loses, what's next?","Even if Pete Buttigieg doesn't nab his party's nomination, he has raised his profile to the point few expect him to fade from the national scene."
Pete Buttigieg: Four ways I'll make America a better place for women,I pledge to nominate at least 50% women to my Cabinet and to the judiciary. Gender equity will be at the forefront of our policies at home and abroad.
Pete Buttigieg says he offers style and message parallels with Barack Obama's Iowa campaign,"As Pete Buttigieg tries to stand out in Iowa this weekend, he's drawing parallels to former President Barack Obama's first campaign in the state."
Buttigieg campaign says attorney who blocked release of police shooting footage no longer co-hosting fundraiser,"South Bend, Indiana, Mayor Pete Buttigieg's presidential campaign said Friday that it was returning money donated and raised by a Chicago attorney who had ..."
Buttigieg focus groups found being gay ‘a barrier’ for some black South Carolina voters,Focus groups conducted by Pete Buttigieg's 2020 campaign over the summer found that being gay was “a barrier” for black South Carolina Democratic primary ...
Buttigieg distances himself from his McKinsey consulting days,"Pete Buttigieg still lists “businessman” in his Twitter bio. He just doesn't talk much about the business anymore. For years, Buttigieg's stint at McKinsey ..."
"Voters say Buttigieg's logo works for beer, a fancy restaurant or 'the fighting Petes'",Some voters think Pete Buttigieg's logo would look good on a bottle of beer. Others think it would work in the window of a classy restaurant. One man thought it ...
"‘I tremble for my country,’ Buttigieg says while meeting Rock Hill groups","Presidential hopeful Pete Buttigieg met with multiple leaders in York County at the Catawba Indian Nation, AME Zion Church and The Wall That Heals in Rock ..."
Beto O'Rourke escalates fight with Pete Buttigieg over guns,"Beto O'Rourke sharply criticized Pete Buttigieg this week after the South Bend, Indiana, mayor called O'Rourke's push for mandatory buy-backs of assault-style ..."
"The Biden alternative: Pete Buttigieg's SC strategy centers on pragmatism, personality","In South Carolina, where Barack Obama's former vice president polls higher here than in any other early state, many voters at Pete Buttigieg events say they see ..."
Debate Profile: Pete Buttigieg,"A combat veteran and Rhodes scholar, Pete Buttigieg is in his eighth and final year as Mayor of South Bend, Indiana. Buttigieg served as a lieutenant in the U. S. ..."
Buttigieg says there would be ‘a lot of benefit’ if Trump were defeated in 2020 instead of removed from office,"I think that is what will be required for congressional Republicans to be reunited with their conscience,” Pete Buttigieg, South Bend, Ind., mayor and 2020 ..."
South Bend Election: Who Will Be Next Mayor Pete?,"Pete Buttigieg's former chief of staff, James Mueller, is vying with a Republican challenger to be the next mayor of South Bend, Indiana."
Buttigieg to O'Rourke: I don't need lessons from you,"During the Democratic Party's presidential debate, Beto O'Rourke and Mayor Pete Buttigieg sparred over O' Rourke's suggestion for a mandatory buyback of ..."
How Pete Buttigieg would lower drug prices,Democratic presidential hopeful Pete Buttigieg on Monday released a plan to lower the cost of prescription drugs while also boosting U.S. investment in new ...
"Pete Buttigieg is making history with 2020 run, but many Americans think US not ready for gay president","Although 40% of voters thought the U.S. was ready for a gay president, 44% said it was not. And they were more skeptical about their neighbors."
The Ticket: Pete Buttigieg Finds His Spot Among the Top Contenders,"WEST SACRAMENTO — There are several Democrats running for president in 2020 and while some have chosen to go on the attack, others, like South Bend, ..."
Pete Buttigieg joins 2020 Democrats' leftward march on drug prices,"Pete Buttigieg released Tuesday his plan to reduce prescription drug prices, which includes many of the liberal proposals that have become the new Democratic ..."
Buttigieg ramping up presidential campaign in Nevada,"Democratic presidential candidate Pete Buttigieg is ramping up his ground game in Nevada, staffing up and opening offices in Las Vegas and more rural areas ..."
Hedge fund titan Paul Tudor Jones is apparently a fan of presidential hopeful Pete Buttigieg,"Billionaire hedge fund investor Paul Tudor Jones voices his support for Democrat Pete Buttigieg at a recent gala, according to a report."
Buttigieg to Attend Private Campaign Fundraisers in Chevy Chase,"Democratic presidential candidate Pete Buttigieg, mayor of South Bend, Ind., is attending two private campaign fundraisers in Chevy Chase."
Buttigieg: Warren more specific on selfies than healthcare,"During an interview with CNN's Alisyn Camerota, Mayor Pete Buttigieg reacts to a moment during the debate when he clashed with Sen. Elizabeth Warren ..."
Will Mayor Pete’s Breakout Performance Actually Move His Poll Numbers?,"It's not hard to know what the fallout from this debate will be: Pete Buttigieg offered his strongest performance of his campaign, with a series of forceful, coherent ..."
Protesters interrupt Pete Buttigieg to highlight plight of black trans women,"Protesters interrupted the CNN LGBTQ town hall on Thursday to highlight the plight of black transgender women, at one point taking the mic from a questioner."
Democratic debate: Pete Buttigieg and Beto O’Rourke’s feud over assault weapon buybacks boils over,The disagreement between the two centered on conflict over a mandatory assault weapons buyback. While O'Rourke has argued that a buyback would help ...
"Pete Buttigieg, Tulsi Gabbard spar at debate over Trump's Syria retreat - Business Insider",South Bend Mayor Pete Buttigieg and Democratic Rep. Tulsi Gabbard of Hawaii had a heated exchange over the circumstances that led to President Donald ...
"Pete Buttigieg on Impeachment Hearings, Favorite Films and TV Binges","Pete Buttigieg spoke with THR about his pop culture tastes, his favorite superheroes (he thinks Batman might be depressed) and why the impending ..."
"Buttigieg: 'Meaning' of Medicare for all has changed; 'good chance' Facebook, other tech companies broken up if he becomes president","South Bend Mayor Pete Buttigieg joined The Nevada Independent on the Indy Matters podcast this week to talk about his prior support for Medicare for all, ..."
"What Pete Buttigieg Now Says About Facebook, Big Tech","Democratic presidential candidate Pete Buttigieg says Facebook's policy to not filter out phony political ads is ""a mistake"" and breaking up big tech companies ..."
Pete Buttigieg picks up more endorsements from Ohio Democrats,"Buttigieg only received 5 percent support in a recent Ohio poll, but he has a commanding early lead when it comes to endorsements from Ohio Democrats."
"Buttigieg blasts Trump on Syria, says he’d make ‘better' deals","Democratic presidential hopeful Pete Buttigieg on Sunday dismissed President Donald Trump's move to withdraw U.S. troops from Syria, saying he'd make ..."
From Harvard to SNL: How Pete Buttigieg and Colin Jost are crossing paths 15 years later,"When Colin Jost stepped onto the Studio 8H stage in Pete Buttigieg's trademark rolled-sleeved white button down and blue tie, he wasn't just another comedian ..."
Photos: Pete Buttigieg on the 2020 Presidential Campaign Trail | America 2020,"Sept. 21, 2019 | Des Moines, Iowa | Democratic presidential candidate and South Bend Mayor Pete Buttigieg makes his way to speak to supporters during the ..."
"Protestors call for release of police tapes, Mayor Pete responds","SOUTH BEND, Ind. --- The seven-year-long battle involving the South Bend Police Tapes gained more attention today as advocates called for the release of the ..."
Buttigieg kicks off early state organizing push following big fundraising haul,"On the heels of a third fundraising quarter where the campaign raised $19.1 million dollars, one of the top hauls in the field, Buttigieg is putting that money to ..."
"Mayor Pete Buttigieg: Country needs more union members, higher minimum wage","In a visit to Los Angeles with other Democrats to woo union members, Mayor Pete Buttigieg said the country needs to double its unionization rates and increase ..."
Pete Buttigieg: Young Democratic candidate defying categorisation,"The gay, Christian mayor of South Bend, Indiana is widening his appeal among voters."
2020 Election: Pete Buttigieg's National Security Vision,Pete Buttigieg recently criticized the foreign policy of previous Democratic and Republican administrations as being incoherent and obsolete.
Campaign pictures: Pete Buttigieg in Philadelphia,"South Bend, Ind. Mayor Pete Buttigieg males his first campaign stop in Pennsylvania. The Democratic presidential candidate spoke at a rally outside Reading ..."
"Pete Buttigieg Hangs With Leonardo DiCaprio, Paris Hilton; Back In L.A. This Weekend For Fundraising","Pete Buttigieg will be back in L.A. fundraising again this weekend, just days after another swing through Hollywood circles, including an event that drew guests ..."
Tennessee politician's rant includes homophobic slur in apparent reference to Pete Buttigieg,"SEVIER COUNTY, Tenn. — Sara Thompson knew her views did not reflect the majority at Monday's county commission meeting. The main item on the agenda ..."
Buttigieg is investing in Indiana despite its late primary. Here's why.,"South Bend, Indiana, mayor Pete Buttigieg's latest move is a signal he plans to be a major player in the presidential primary for the long haul."
Buttigieg emerges as moderate alternative,"Who'd a thunk it? In the post-mortem of the Democrats' Tuesday night debate, the consensus among the chattering class was that Pete Buttigieg not only had a ..."
Mayor Pete Buttigieg Addresses Fashion Crowd in New York,Mayor Pete Buttigieg spoke at a New York fundraiser for God's Love We Deliver that was packed with celebrities like Tiffany Haddish and Neil Patrick Harris.
Buttigieg comes calling for Chicago cash again,The South Bend mayor also slates a talk at the University of Chicago in his latest visit to the Windy City.
Pete Buttigieg heads to Las Vegas for two-day campaign swing,Democratic presidential candidate Pete Buttigieg will come to Las Vegas this week for a two-day campaign swing. The Buttigieg campaign says the mayor of ...
Pete Buttigieg and Brad Stevens dressed as each other for Halloween,"Campaigning in New Hampshire this week, the South Bend, Ind., mayor simply got rid of his tie, picked up a clipboard, and threw on a Boston Celtics hat."
Buttigieg Drops Policy Plan to Usher in 'New Era' for LGBT,"Pete Buttigieg's campaign has released a set of proposals outlining his LGBT agenda, a bid to own the issue when many LGBT priorities have become ..."
Buttigieg: I'd keep troops in Syria if needed,"2020 Democratic presidential candidate and veteran Mayor Pete Buttigieg responds to President Trump's decision to pull troops out of Syria, a move Buttigieg ..."
Pete Buttigieg: Ending Trump Presidency is a 'Huge Priority Because Our Country's Future Depends On It',"Mayor Pete Buttigieg talked up his run for Democratic presidential candidate Monday night on The Tonight Show Starring Jimmy Fallon, right after a new poll put ..."
Pete Buttigieg At LGBTQ Town Hall: ‘My Blood’s Not Welcome In This Country’,"The South Bend, Indiana, mayor and openly gay presidential candidate said he would overhaul FDA rules that ban sexually active gay men from donating blood."
READ: Transcript of Pete Buttigieg's exclusive interview with The Hill | TheHill,"RENO, Nev."
Chasten Buttigieg fundraising for husband Pete overseas | TheHill,"Chasten Buttigieg, the husband of presidential candidate and South Bend, Ind., Mayor Pete Buttigieg, will reportedly tour three European countries next week to ..."
Pete Buttigieg longs for a non-political Supreme Court. That’s impossible.,"Mayor Pete Buttigieg made a splash early in his presidential bid by suggesting that Democrats may need to resort to court-packing, expanding the Supreme ..."
Presidential candidate Pete Buttigieg speaks at UChicago Institute of Politics,"CHICAGO — On the heels of his pundit-determined “win” of the fourth Democratic presidential debate, Pete Buttigieg, mayor of South Bend, Indiana, spoke to a ..."
Mayor Buttigieg's chances at the 2020 nomination,"WESTERVILLE, OH. -- Twelve candidates will be on stage for the crucial debate at Otterbein University including South Bend Mayor Pete Buttigieg."
"Pete Buttigieg, city consultant outline new approach to women and minority contracting",SOUTH BEND — Community activists and black entrepreneurs Thursday night said they were optimistic about the city's plans to buy more goods and services ...
Pete Buttigieg dismisses claim that Tulsi Gabbard is a 'Russian asset',"Democratic presidential candidate Pete Buttigieg on Sunday dismissed the claim that fellow 2020 hopeful Rep. Tulsi Gabbard is a ""Russian asset,"" saying ""there ..."
So … About That Buttigieg Surge?,"Welcome to FiveThirtyEight's weekly politics chat. The transcript below has been lightly edited. sarahf (Sarah Frostenson, politics editor): After the fourth De…"
Pete Buttigieg explains why he's against Medicare for All,Democratic presidential candidate Mayor Pete Buttigieg explained why he's against Medicare for All and instead in favor of giving people a choice.
Buttigieg reacts to Hillary Clinton's swipe at Gabbard,CNN's Jake Tapper asked Democratic presidential hopeful Mayor Pete Buttigieg to weigh in on former Democratic presidential nominee Hillary Clinton ...
"Buttigieg Addresses Black Church, Taking Biden Voters Head On","Pete Buttigieg went straight to the heart of Joe Biden's support in South Carolina on Sunday, bringing a message of healing and unity to a black church."
Mayor Pete Buttigieg on challenging Democratic presidential frontrunners,"This is a rush transcript from ""Fox News Sunday,"" October 20, 2019. This copy may not be in its final form and may be updated. CHRIS WALLACE, ANCHOR: I'm ..."
Buttigieg releases digital ad in three early states | TheHill,"White House hopeful Pete Buttigieg on Tuesday released a paid digital ad in Iowa, New Hampshire and Nevada as he works to gin up support in the crucial ..."
Gabbard and Buttigieg spar over Trump's Syria withdrawal,Mayor Pete Buttigieg and Rep. Tulsi Gabbard (D-HI) got into a heated exchange over President Donald Trump's decision to withdraw troops from Syria and how ...
Buttigieg defends court-packing proposal at Democratic debate | TheHill,"South Bend, Ind., Mayor Pete Buttigieg was the only Democratic presidential candidate on the debate stage Tuesday night to explicitly endorse court packing as ..."
Buttigieg campaign draws comparisons to Obama ahead of key Iowa event | TheHill,"Pete Buttigieg's campaign drew comparisons between the South Bend, Ind., mayor's 2020 presidential bid and former President Obama's 2007 presidential bid."
Criminal justice reform can't only enact neutral policies. It must reverse years of racist ones.,"Presidential candidate Pete Buttigieg outlines his criminal justice reform plan to tackle mass incarceration, racial disparities in policing and more."
Pete Buttigieg wants South Bend police reform recommendations before he leaves office,"SOUTH BEND — Mayor Pete Buttigieg expects to receive a consultant's assessment of police practices and operations before he leaves office at year's end, and ..."
Buttigieg rally planned at Waverly-Shell Rock High School,"Democratic presidential candidate Pete Buttigieg is coming back to Iowa starting on Friday, visiting seven cities, including Waverly."
"Pete Buttigieg Reacts to Colin Jost 'SNL' Impression, Plays Fallon Game",Mayor Pete Buttigieg responded to Colin Jost's impression of him on 'Saturday Night Live' during Monday's episode of 'The Tonight Show Starring Jimmy Fallon.
Why Pete Buttigieg Annoys His Democratic Rivals,"His success, especially in Iowa, has grated on rival campaigns that say his record in government is not commensurate with the attention he's receiving."
"As Pete Buttigieg Surges in Iowa Ahead of Debate, Fellow Democrats Sharpen Their Attacks",Staffers on other Democratic campaigns call him “Sneaky Pete” or “Mayor McKinsey” because of his ties to the business community. Others assail him as “Mayo ...
Pete Buttigieg is having a moment,"This was originally published in the November 6 edition of CNN's Meanwhile in America, the daily email about US politics for global readers. Sign up here to ..."
"Pete Buttigieg - Husband, Policies & Age","Pete Buttigieg is a former two-term mayor of South Bend, Indiana. A graduate of Harvard University and an Oxford Rhodes Scholar, Buttigieg enlisted in the U.S. ..."
Pete Buttigieg has his sights set on Elizabeth Warren in Iowa,"Decorah, Iowa (CNN) In the first few minutes of his bus tour that began Saturday, Pete Buttigieg said he misspoke. He hadn't meant to say that the 2020 ..."
"O.K., Mayor: Why 37-Year-Old Pete Buttigieg Is Attracting Boomers","Calling himself the “retirement guy” and pitching a “Gray New Deal,” Mr. Buttigieg has crafted a message that resonates among older white Americans, helping ..."
Is Pete Buttigieg peaking too soon?,The last 48 hours may well be the best 48 hours of South Bend Mayor Pete Buttigieg's 2020 presidential campaign.
Pete Buttigieg Isn’t Going Anywhere,"This year, the Millennial mayor became a household name. Now how does he translate that into votes?"
