title,media
Pete Buttigieg is on the attack in Iowa,"Speaking on Friday to a town hall crowd at the Masonic Temple in Clinton, a small Mississippi River town an hour north of the Quad Cities, Pete Buttigieg started ..."
"2020 California Democratic primary: Pete Buttigieg on wildfires, housing, aging and greenhouse gas emissions","Ahead of California's March 3 presidential primary election, we asked Democratic candidates to answer experts' questions about issues facing the state."
"Feder: Before he became 'Mayor Pete,' Buttigieg worked as NBC 5 investigative intern","For six weeks during the summer of 2002, a 20-year-old college student named Peter Buttigieg toiled in the background as an intern at WMAQ-Channel 5, the ..."
Pete Buttigieg is playing with fire — and playing right into Republicans’ hands,"As the actual voting in the 2020 Democratic presidential primaries approached, Pete Buttigieg began running more and more as a moderate. The candidate who ..."
Briggs: Pete Buttigieg is an elitist. He should embrace it.,"Pete Buttigieg has an elitism problem. The more he tries to prove that he is not an elitist, the more obvious it is to everyone that he is. The former South Bend ..."
Why I'm voting for Mayor Pete — Contributors — Bangor Daily News — BDN Maine,Mayor Pete is an inspiring aspirational figure who has real accomplishments and sacrifices to hold up against Trump's lies and conspiracy theories. His quiet ...
'What's a gay candidate meant to look like?': Buttigieg and LGBTQ+ voters,"The ex-mayor's sexual orientation barely registered with voters – until now, as some LGBTQ+ millennials point to a distinction between being gay and being ..."
Pete Buttigieg is the embodiment of white privilege – and black voters know it,Pete Buttigieg is the embodiment of white privilege – and black voters know it | Pete Buttigieg | The Guardian.
Why Amy Klobuchar and Pete Buttigieg needed to fight it out in Vegas - Business Insider,"With heavy crossover appeal among their supporters and a two-three finish in New Hampshire, Amy Klobuchar and Pete Buttigieg took the gloves off."
Buttigieg quipped he's a 'Microsoft Word guy' during Democratic debate - Business Insider,"Democratic presidential candidate Pete Buttigieg quipped he was more of a ""Microsoft Word guy"" during Wednesday's candidates' debate in Nevada."
A Catholic case for Pete Buttigieg,"When Pete Buttigieg announced his candidacy for the presidency in April of 2019, some wrote him off as too audacious, too inexperienced, too unknown to be a ..."
Pete Buttigieg refused to answer NYT's foreign policy questions - Business Insider,Former Mayor Pete Buttigieg declined to answer numerous questions about his positions on leading foreign policy challenges posed in a recent New York ...
Pete Buttigieg releases details for this weekend's town hall in Colorado,"Democratic presidential candidate Pete Buttigieg plans to hold a town-hall style campaign event at a hotel in Northeast Denver on Saturday night, just 10 days ..."
Pete Buttigieg Dodges Questions on Black Marijuana Arrests,Pete Buttigieg spent the weekend justifying his obfuscation on a debate question about racially disproportionate marijuana arrests in South Bend.
Pete Buttigieg's Economic Plan: Keep Calm and Cut Costs,Centrist Pete Buttigieg has emerged as a powerful contender among more radical rivals.
Pete Buttigieg Wants To Ride Momentum From Iowa And New Hampshire Into Pennsylvania,"PITTSBURGH (KDKA) — *Fresh* off a win in Iowa and a second-place finish in New Hampshire, Democratic presidential candidate Pete Buttigieg says the ..."
Elizabeth Warren Has a Pete Buttigieg Problem,"In Iowa and New Hampshire, it's Mr. Buttigieg — not Bernie Sanders — who has complicated Ms. Warren's path, winning over college-educated white voters ..."
Pete Buttigieg’s campaign uniform in the weeks before Iowa,"Former South Bend, Ind., mayor Pete Buttigieg hustled around Iowa before the caucuses, holding more than 50 town halls in a frantic three-week period."
"For Pete Buttigieg's supporters, his identity is an afterthought - Business Insider","Insider was with Buttigieg's campaign as it courted black voters in South Carolina, where his stature as a LGBTQ trailblazer was an afterthought."
Pete Buttigieg: 5 things to know,Here are five things to know about the former mayor-turned-presidential frontrunner.
"Pete Buttigieg campaigns in L.A., goes after Bloomberg, Sanders","Pete Buttigieg campaigns in Los Angeles, warning Democrats that either Michael R. Bloomberg or Bernie Sanders would be a 'very, very tough sell' to voters in ..."
Democratic Presidential Hopeful Pete Buttigieg Coming to Arlington,"(Updated at 6:10 p.m.) Pete Buttigieg, Democratic candidate for president and former mayor of South Bend, Indiana, is making another appearance in Arlington ..."
Pete Buttigieg's Elite-Friendly Politics Won't Help the Marginalized,Pete Buttigieg is this election's poster child for “progressive neoliberalism” — offering up platitudes about diversity while leaving untouched the very structures ...
"Pete Buttigieg will be in Sacramento, Modesto Friday","Presidential candidate Pete Buttigieg is returning to Northern California after the New Hampshire primary. The former mayor of South Bend, Indiana, will be in ..."
Democratic presidential candidate Pete Buttigieg holds fundraisers in the Bay Area,"Former South Bend, Indiana Mayor and presidential candidate Pete Buttigieg is visiting the Bay Area today for fundraisers in San Francisco and Palo Alto."
Presidential candidate Pete Buttigieg holds rally for supporters in Raleigh,"RALEIGH, N.C. — Before former Vice President Joe Biden's victory in South Carolina, Senator Bernie Sanders took Nevada and New Hampshire, with Pete ..."
"Buttigieg says stop-and-frisk was racist, acknowledges own uneven history on race as mayor",Pete Buttigieg referenced his own uneven history with racial justice in South Bend before condemning Michael Bloomberg's stop-and-frisk policy.
Super Tuesday: Pete Buttigieg says he's less divisive 'alternative' to Bernie Sanders,Democratic presidential candidate Pete Buttigieg is making his final pitch to California voters ahead of the state's primary. In a one-on-one interview with ABC7 ...
Presidential hopeful Pete Buttigieg announces where Sunday rally will be in Dallas,Democratic presidential hopeful Pete Buttigieg has announced a location for the rally he's holding in Dallas on Sunday. The free rally will be at Main Street ...
Pete Buttigieg is canvassing his Twitter followers ahead of Super Tuesday,The Pete Buttigieg campaign is deploying any army of Twitter volunteers to “digitally door-knock” likely supporters ahead of the important Super Tuesday ...
Buttigieg reluctantly embraces his barrier-breaking candidacy,"MANCHESTER, N.H. — Chasten Buttigieg grabbed his husband's shoulder. The data from Iowa's precincts had been trickling into Buttigieg headquarters in ..."
'Being gay is not enough': Buttigieg's candidacy divides LGBTQ Democrats,"While the 2020 presidential candidate's policies play a part, the tensions appear centered on Pete Buttigieg's “privilege” and queer representation."
Is Pete Buttigieg too young to be president?,Is Mayor Pete Buttigieg too young to be president? Our nation's founders didn't think so; among the few limitations they applied to presidential aspirants was a ...
"The CIA, abused dogs, the Iowa app and 'Breathe Easy': Buttigieg draws rumors, conspiracies","SOUTH BEND — Conspiracy theories and rumors have always surrounded presidential campaigns, so it shouldn't be a surprise that South Bend's former mayor ..."
How Pete Buttigieg climbed to the top (for now) in Iowa: He showed strength across Iowa counties,"Democratic presidential candidate Pete Buttigieg's strength across Iowa counties, including in rural and suburban areas, helped fuel his strong showing on ..."
Democratic presidential candidate Pete Buttigieg coming to Utah,Democratic presidential candidate Pete Buttigieg is coming to Utah and will hold a town hall in Salt Lake City ahead of the Super Tuesday primary election.
Buttigieg says early success will boost his support among voters of color,Presidential candidate Pete Buttigieg suggested Tuesday that strong showings in the Democratic primary's early states would boost his still-flagging support ...
LGBTQ Advocates In Chicago React To Pete Buttigieg's Strong Iowa Results,Mayor Pete Buttigieg made a strong showing in the Iowa caucuses as an openly gay man. Many LGBTQ folks are thrilled by the success — but other LGBTQ ...
RGJ exclusive | Buttigieg: Nevadans do not have to choose revolution or the status quo,Some have told us that this choice comes down to revolution or a return to the broken ways of the past. I reject that false choice — and Nevadans should too.
"Ahead Of Iowa Caucuses, Pete Buttigieg's Momentum Slows","Morning Edition hosts Rachel Martin and David Greene talk to Democratic presidential candidate Pete Buttigieg, ex-mayor of South Bend, Ind., who is among 11 ..."
Election 2020 Pete Buttigieg,Democratic presidential candidate and former South Bend Mayor Pete Buttigieg takes photos with members of the crowd after his town hall meeting at Keene ...
Analysis | The Finance 202: Pete Buttigieg lures even closer look from Wall Street donors following strong Iowa caucuses performance,"'I think the Wall Street crowd thought he was fading and is surprised he [may have] won Iowa,' one Wall Street lobbyist said."
"In Malta, a land of 2,850 Buttigiegs, they’re rooting for Mayor Pete","In this craggy, sun-kissed village of 2,000 people, three of the past four mayors have had the same last name: Buttigieg. The opposition leader is a Buttigieg, too."
Pete Buttigieg has his message for voters in Nevada,"Appearing on MSNBC's “Morning Joe” on Wednesday, a day after the New Hampshire primary, former South Bend, Ind., mayor Pete Buttigieg told voters, ..."
Democratic presidential hopeful: Pete Buttigieg,"Policy information for Democratic candidate for president, former South Bend Mayor Pete Buttigieg."
Pete Buttigieg holding town hall in Salt Lake City tonight,"SALT LAKE CITY — Pete Buttigieg picked up another Utah endorsement, from Salt Lake County District Attorney Sim Gill, that was announced ahead of a ..."
Buttigieg Campaign Aims To Build Diverse Coalition Of Supporters,NPR's Steve Inskeep talks to Democratic Rep. Anthony Brown of Maryland about the strategy for the Pete Buttigieg campaign to gain traction with black voters ...
Buttigieg maintains narrow lead over Sanders in Iowa after recanvass,"The recanvass of more than 100 Iowa caucus precincts has ended, the state's Democratic Party said on Tuesday, resulting in former South Bend, Indiana, Mayor ..."
Pete Buttigieg Climate Profile: Making US the World's Clean Tech Leader,"'If this generation doesn't step up, we're in trouble. This is, after all, the generation that's gonna be on the business end of climate change for as long as we live.'"
Why Pete Buttigieg Isn’t Carrying the Queer Vote,"Democratic presidential candidate Pete Buttigieg's campaign sign 'Pete 2020' is seen in the Castro District of San Francisco, December 8, 2019. “By the time it's ..."
Buttigieg holds a massive rally in Virginia. But are there enough of his fans?,"A nice, decent intellectual might not be appreciated by enough voters."
A look at Mayor Pete Buttigieg's fight to win the moderate vote in California -- Chasing California 2020,"In this episode of Chasing California 2020, ABC7 went one-on-one with 2020 presidential election candidate Mayor Pete Buttigieg to discuss the challenges he ..."
Buttigieg hits Sanders by name over health care in new South Carolina TV ad,"Pete Buttigieg will begin airing a new television ad in South Carolina on Friday night that attacks Sen. Bernie Sanders by name over his ""Medicare for All"" health ..."
Pete Buttigieg had a plan for February. It didn't work out as he hoped.,"Raleigh, North Carolina (CNN) Pete Buttigieg had a plan heading into February: Turn a strong performance in Iowa into enough momentum to compete in New ..."
What's Pete Buttigieg going to do next?,"As Pete Buttigieg took the stage in South Bend, Indiana, to announce his decision to end his 2020 presidential campaign, chants of ""2024!"" broke out in the ..."
Pete Buttigieg is ending his presidential bid,"Pete Buttigieg, the 38-year-old former mayor of South Bend, Ind., who saw a meteoric rise from virtual unknown to top-tier contender and became the first openly ..."
"Pete Buttigieg won't be president in 2020, but his campaign changed the game for LGBTQ Americans","From the start, Buttigieg's sexual orientation and faith set him apart from the standard Democratic presidential hopeful -- and especially his ability to square the ..."
The Two Things That Sank Buttigieg’s Candidacy,"Figuring out why Pete Buttigieg dropped out of the presidential race yesterday is easy. He had gotten trounced in South Carolina, appeared likely to get trounced ..."
Pete Buttigieg endorses Joe Biden for president,"Pete Buttigieg is endorsing former Vice President Joe Biden for president on Monday, a day after the former mayor of South Bend, Indiana, exited the 2020 race."
"A Conversation With Pete Buttigieg, Who’s Stuck at Home Like Everyone Else","Talking with Pete Buttigieg, who is holed up in South Bend amid the coronavirus pandemic, and figuring out his next steps in public life."
"Goodbye, Pete Buttigieg. You were always more of a symptom than a cure","When Joe Biden failed to crumble, there was no reason for Pete Buttigieg to exist. It's still incredible that he got so far."
What Pete Buttigieg Understood,"Pete Buttigieg and I disagree on many policies, which you might expect, because he describes himself as a progressive and I'm a conservative. I believe his ..."
Pete Buttigieg endorses Joe Biden,"Washington (CNN) Pete Buttigieg endorsed Joe Biden for president Monday night, telling a crowd in Dallas the former Vice President is the right candidate to ..."
Buttigieg delivers emotional speech as he suspends campaign,"Democratic presidential candidate Pete Buttigieg and his husband Chasten address supporters in South Bend, Indiana, formally announcing that he is ..."
Pete Buttigieg to endorse Joe Biden for Democratic nomination,"Former South Bend mayor Pete Buttigieg plans to endorse fellow centrist Joe Biden in the Democratic presidential nominating contest on Monday, shortly after ..."
Former South Bend Mayor Pete Buttigieg to be on TODAY on Monday,(WNDU) -- Former South Bend Mayor Pete Buttigieg has scheduled his first televised interview after dropping out of the race to become the Democratic nominee ...
‘RS Interview: Special Edition’ With Pete Buttigieg,"Rolling Stone launches its latest new video series today, titled “RS Interview: Special Edition.” Episodes will feature in-depth conversations with notable people ..."
Howey: Secretary of State Pete Buttigieg?,I believe that a President Biden should be thinking big when it comes to Buttgieg's future. Like secretary of state.
Opinion | How Buttigieg Won His Last Primary—with the Press Corps,"If you want a friend in politics, to paraphrase Harry Truman, you should get a dog—but if the pound is running short on dogs or allergies pose an issue, ..."
Pete Buttigieg's choice in music and 3 other observations from the campaign trail,"From the music he played to the questions he took, Pete Buttigieg had a style of his own on the campaign trail."
Silicon Valley saw itself in Pete Buttigieg. Now he’s out of the race.,"Tech's darling is out. On Sunday, the 38-year-old Democratic presidential contender stepped out of the race, clearing a path for moderates to coalesce around ..."
Pete Buttigieg: ‘Today Is a Moment of Truth’,"Former South Bend, Ind., Mayor Pete Buttigieg announced he was suspending his campaign Sunday evening."
Pete Buttigieg to end White House bid after improbable rise,Buttigieg showed early promise but his campaign lost momentum in Nevada and he came a distant fourth in South Carolina.
Why Pete Buttigieg should be DNC chairman,"It's not over for Pete Buttigieg. His presidential bid has been set aside, but his desire to “bring a new kind of politics to our country” could be fulfilled if Democratic ..."
OPINION: What's next for Pete Buttigieg?,"Former mayor of South Bend, Indiana, Pete Buttigieg ran a historic campaign. Whether you agree with his policies or not, it is remarkable that a gay mayor of a ..."
Pete Buttigieg discusses his political future and recent campaign,"SOUTH BEND, Ind. – Former South Bend Mayor Pete Buttigieg shared his thoughts just a few days after dropping out of the 2020 presidential race. Buttigieg ..."
Commentary: Toni Atkins backs Pete Buttigieg for president,"Toni Atkins: California voters should support Pete Buttigieg for President. He has experience and vision to defeat Donald Trump, lead the nation."
What's next for Buttigieg after he said goodbye to presidential bid? An expert weighs in,"Former South Bend Mayor Pete Buttigieg is heading to Dallas tonight, expected to publicly endorse former Vice President Joe Biden for President. We asked ..."
Briggs: This number shows why Pete Buttigieg would struggle in a run for Indiana governor,"Pete Buttigieg is not swooping in to run for Indiana governor. That has seemed obvious for many months. Nonetheless, after Buttigieg dropped out of the ..."
"At Dallas rally site, dismay and discounted T-shirts after Pete Buttigieg abruptly drops out","David and Pat Perkins took the train from Fort Worth to see Pete Buttigieg at a rally Sunday evening in Dallas. By the time they heard he had dropped out, it was ..."
Monday briefing: Pete Buttigieg quits Democratic race | World news,Field clearing for Sanders-Biden showdown on Super Tuesday tomorrow … Second US death ramps up virus fears … M&S expands 'fill-your-own' scheme.
Pete Buttigieg is dropping out of 2020 presidential race,"(CBS NEWS) - Pete Buttigieg, the 38-year-old former mayor of South Bend, Indiana, who skyrocketed to be a top contender in the Democratic race, is dropping ..."
Pete Buttigieg plans to endorse Joe Biden in Democratic primary,"Former South Bend, Indiana, Mayor Pete Buttigieg plans to endorse Joe Biden in the Democratic presidential nominating contest on Monday, shortly after ..."
AP sources: Pete Buttigieg ending his presidential campaign,Democrat Pete Buttigieg is ending his campaign for president. Three people with knowledge of Buttigieg's decision tell The Associated Press he is informing ...
'Mayor Pete' Departs: Buttigieg Suspends Presidential Campaign,"Updated at 9:25 p.m. ET. Pete Buttigieg, the 38-year-old who rose from being mayor of a midsize Indiana city to mounting a serious presidential run, officially ..."
Pete Buttigieg drops out of presidential race,"Pete Buttigieg, the former mayor of South Bend, Indiana, is ending his presidential run."
The Exit Interview: Pete Buttigieg – Indianapolis Monthly,"Pete Buttigieg is holed up at home, riding out the coronavirus with a growler of South Bend Brew Works IPA and plans for the future."
Pete Buttigieg’s trailblazing campaign was a historic step forward for LBGTQ candidates,"Jonathan Rauch reflects on the successes of the Pete Buttigieg's campaign and the gamble he took that America would accept a gay candidate for president, ..."
Barack Obama and the End of Pete Buttigieg’s Campaign,"Obama—young, handsome, and from a midwestern state—came preaching hope and unity in the face of division. It worked exceedingly well … for him."
"EXCLUSIVE: As Pete Buttigieg Suspends Campaign, We Disclose His Favorite Musical","Just after the New Year, TheaterMania reached out to several of the 2020 Democratic presidential candidates for comment on an issue relevant to their ..."
Pete Buttigieg Suspends Presidential Campaign As California Primary Nears,SAN FRANCISCO (CBS SF) — Pete Buttigieg is ending his race for Democratic presidential nomination less than two days before Californians head to the polls ...
"In his selflessness, Mayor Pete is a leader for the future",Here's what readers are saying in Tuesday's letters to the editor.
Pete Buttigieg Answers LA Mag's Candidate Questionnaire,"Pete Buttigieg of Indiana takes the L.A. Mag questionnaire, talking immigration, the environment, housing, and other big issues."
Pete Buttigieg’s candidacy meant a lot to LGBTQ Christians like me,"“The time has come for more of a religious left to emerge in our country that lets people know they are not alone when they look at faith,” former 2020 candidate ..."
How Pete Buttigieg departed shows why we endorsed him,"Less than 72 hours after the Orlando Sentinel endorsed Pete Buttigieg he was out of the race, but his manner of leaving shows why we chose him."
"Pete Buttigieg ends bid for White House, leaves some Texas supporters in tears","Former South Bend, Indiana, Mayor Pete Buttigieg ended his presidential bid Sunday and canceled his Dallas rally, leaving supporters sad. Some were in tears."
"Pete Buttigieg drops out of the 2020 race, one day after being certified as the Iowa Caucus winner","After almost a month of problems and delays, the Iowa Democratic Party (IDP) finally certified the results of the Iowa Caucus on Saturday, declaring Pete ..."
‘Jimmy Kimmel Live’: Pete Buttigieg to host show March 12,"After ending his presidential campaign earlier this month, Pete Buttigieg has revealed his next step — late night television."
"Pete Buttigieg, Hosting ‘Jimmy Kimmel Live,’ Jokes About Presidential Bid: “Turns Out I Was About 40 Years Too Young And 38 Years Too Gay”","In Pete Buttigieg's guest hosting stint before an audience-less Jimmy Kimmel Live on Thursday, he gave sometimes awkward and mostly amusing monologue, ..."
"Pete Buttigieg on life after the trail, whether Bernie Sanders should drop out and campaigning during coronavirus","In an interview with The Post's Chelsea Janes, Buttigieg talks about lessons learned and what might come next."
"Daywatch: Pete Buttigieg drops his presidential bid, second US coronavirus death reported and Wendy’s joins th",Want Daywatch delivered to your inbox? Sign up here. | Get the top Tribune stories of the day on your smart speaker | Here's how to get the most out of your ...
Pete Buttigieg's favorite author would maybe hate Pete Buttigieg,"Welcome to Vox's weekly book link roundup, a curated selection of the internet's best writing on books and related subjects. Here's the best the web has to offer ..."
Pete Buttigieg Ends History-Making Presidential Campaign,Buttigieg went farther in a presidential race than any other openly gay candidate.
A bipartisan Buttigieg effect? The people of this gorgeous island country say yes,"Although American presidential hopeful Pete Buttigieg dropped out of the race this week, his hard-to-pronounce name has given US voters a lesson in ..."
Mayor Pete Believes Dropping Out Is 'the Right Thing to Do for Our Country',The former South Bend mayor had a tough showing in South Carolina and thinks leaving the race is “the right thing” and “what we need to do to heal a divided ...
"Pete Buttigieg ended Democratic presidential campaign, but what about the people who voted for him?","The former South Bend, Indiana mayor ended his bid for the Democratic nomination a day after performing poorly in the South Carolina primary."
Pete Buttigieg speaks after suspending campaign,"Former mayor of South Bend, Ind., Pete Buttigieg tells supporters in his hometown that he is suspending his campaign."
I was a delegate for Pete Buttigieg — until he dropped out. Now what? | Opinion,"Last week saw the suspension of several campaigns for the Democratic presidential nomination including those of Pete Buttigieg, Amy Klobuchar, Michael ..."
Pete Buttigieg to suspend presidential campaign,"The former South Bend mayor is flying back to his hometown to make the announcement, two campaign aides tell NBC News."
"Obama, Biden Spoke to Pete Buttigieg After He Quit 2020 Race","Pete Buttigieg spoke late Sunday by telephone with both Joe Biden and former President Barack Obama after Buttigieg dropped out of the presidential race, ..."
Buttigieg campaign aide tells Fox News why he's ending presidential bid,"Former Mayor Pete Buttigieg suspended his presidential campaign Sunday in an effort to unite his fractured party, a campaign aide for the Democrat told Fox ..."
Pete Buttigieg Endorses Joe Biden for Democratic Nomination,"Pete Buttigieg endorsed former rival Joe Biden for the Democratic presidential nomination on Monday, joining a stream of centrist party leader backing the ..."
How the end of Pete Buttigieg's campaign is shaking up Maine's primary,"His departure is significant in Maine because the former mayor polled at 16 percent, trailing only Vermont Sen. Bernie Sanders. . Maine news, sports, politics, ..."
Pete Buttigieg Grows Beard During Indiana's Stay-at-Home Order,Pete Buttigieg is finally bearded. The first major gay presidential candidate was spotted with some stubble Wednesday during an Instagram Live session — a ...
Pete Buttigieg’s Christianity,At the start of the Pete Buttigieg moment — which recently came to a merciful end — The Atlantic's Peter Wehner wrote that the former mayor's Episcopalian ...
Pete Buttigieg's coded language shows the limits and promise of LGBTQ progress,Research on stigma and discrimination – and LGBTQ people's own stories – can help Americans make sense of Pete Buttigieg's historic candidacy.
Amy Klobuchar and Pete Buttigieg drop out: What happens with their votes in the Washington primary?,"Hundreds of thousands of Washingtonians are voting early in the March 10 presidential primary, even as the Democratic presidential field is shrinking."
