title,media
"Bernie Sanders Scares a Lot of People, and Quite a Few of Them Are Democrats","In 34 national surveys conducted from October 2018 to early April, Joe Biden, who is expected to announce his presidential bid on Thursday, led all competitors."
Sanders quiets his critics as he becomes a 2020 front-runner,"DAVENPORT, Iowa (AP) — Vermont Sen. Bernie Sanders is quieting critics who questioned whether he could recapture the energy of his upstart 2016 ..."
"For Bernie Sanders, 2016 gets in the way of 2020","Early last year, Bernie Sanders huddled with his closest advisers to talk about the future. If he ran for president again, one told him, he'd probably perform well ..."
"Bernie Sanders and his wife earned $1.7 million in past two years, returns show","Sen. Bernie Sanders, who has made income inequality a hallmark of his presidential campaign, earned with his wife about $566,000 last year and $1.15 million ..."
Bernie Sanders' truly awful answer on his newfound millionaire status,Bernie Sanders is (finally) going to release his tax returns. But questions over how he handles his wealth in the context of his campaign for the 2020 Democratic ...
Bernie Sanders pushes back at critics of his new wealth: 'I didn't know it was a crime to write a good book',"Gary, Indiana (CNN) Sen. Bernie Sanders on Saturday rejected suggestions that his growing nest egg, mostly amassed from book sales following his 2016 ..."
Is Bernie Sanders serious?,"It's the first big misstep of the 2020 Democratic primary season. A candidate with an obvious liability hands opponents a powerful, easy-to-grasp issue that ..."
Bernie Sanders will be tested in 2020 as he never was in 2016,"Democratic hopeful Pete Buttigieg signaled the start of a new political era for Sen. Bernie Sanders, one of the front-runners for the party's 2020 presidential ..."
"Bernie Sanders Raised $18 Million in 6 Weeks, His 2020 Campaign Says","WASHINGTON — Senator Bernie Sanders of Vermont raised $18.2 million over the first six weeks of his presidential bid, his campaign announced Tuesday, ..."
Bernie Sanders campaign stop draws hundreds in Warren,"U.S. Senator and Democratic presidential hopeful Bernie Sanders says he won't make the same mistake as the Clinton campaign did in 2016, and assume the."
The machine behind Bernie Sanders’ movement,"A television camera films Vermont U.S. Sen. Bernie Sanders' presidential campaign rally in Keene, N.H. Photo by Kevin O'Connor/VTDigger. KEENE, N.H. ..."
"Bernie Sanders still hasn't released his tax returns, despite pledge","Sen. Bernie Sanders, a leading 2020 Democratic presidential candidate, has yet to release his tax returns despite a pledge to do so."
Bernie Sanders Imagines a Progressive New Approach to Foreign Policy,"In the early summer of 2017, a little less than a year after his Presidential campaign had ended, Bernie Sanders spent a few days on a speaking tour in England, ..."
Takeaways from Bernie Sanders' CNN town hall,"He's a millionaire now, but Vermont Sen. Bernie Sanders showed Monday night what his supporters have liked about him since the 2016 presidential race -- and ..."
Bernie Sanders and the Science of Smears,"The satirist Ambrose Bierce, author of the Devil's Dictionary, once defined radicalism as “the conservatism of tomorrow injected into the affairs of today.”."
Bernie Sanders draws sharp contrasts between himself and Joe Biden,"Sen. Bernie Sanders compared his record with Joe Biden's on trade and foreign policy on Monday, attempting to draw sharp contrasts between himself and the ..."
Bernie Sanders just gave the best political answer on impeachment,"Bernie Sanders didn't build his political career on pragmatism. But on Monday night at a CNN-sponsored town hall, he showed that his presidential candidacy ..."
Bernie Sanders Could Win This Time,"Despite any suggestions to the contrary, Sen. Bernie Sanders's televised Fox News town hall on Monday did not come out of Bizarro World. In fact, it was ..."
Here’s what Bernie Sanders has done better than any of his Democratic presidential rivals,"The Bernie Sanders campaign says the Democratic presidential candidate raised $18 million in this year's first quarter from about 900000 donations, putting..."
Bernie Sanders' 2020 campaign unveils tech tool to increase its voter database,Bernie Sanders on Saturday unveiled a tech tool intended to increase his 2020 campaign's voter database and give him an edge over the Democratic primary ...
Is Bernie Sanders likable enough to become president?,"For many, the Vermont senator's gruff manner is evidence of his authenticity. But some in the party feel he hasn't been subjected to the same personality-based ..."
Bernie Sanders in 1970s Senate race called millionaire senators 'immoral',"Bernie Sanders harshly criticized the wealth of US senators during his first campaign for office in 1971, calling it ""immoral"" that half the members of the Senate ..."
"Sanders gets tough reception at minority women’s event, signaling challenges ahead","HOUSTON — The groans erupted halfway through Bernie Sanders's appearance Wednesday at a presidential candidates' forum sponsored by She the People, ..."
How Sanders left political wilderness to become leader of Democratic pack,The senator has effectively not stopped campaigning since 2015 as the political landscape has shifted – but some are wondering if he can grow his 2020 ...
Are political handicappers giving Bernie Sanders a break?,"If Bernie Sanders is a front-runner for the 2020 Democratic presidential nomination, why is he getting a pass for underperforming in key areas?"
"How Bernie Sanders, The Socialist Senator, Amassed A $2.5 Million Fortune","Bernie Sanders may be a fierce critic of the wealthy, but he's multimillionaire from his hit books, real estate, government pensions and investments."
Bernie Sanders draws mayoral pension while running for president — his campaign co-chair Rep. Ro Khanna once blasted such 'double-dipping',"Sen. Bernie Sanders, the Vermont independent who is seeking the Democratic presidential nomination, for years has drawn a pension for having once been the ..."
Sanders: Even 'terrible people' have the right to vote,"Democratic party presidential hopeful Sen. Bernie Sanders explains during a CNN town hall why he believes people who have committed terrible crimes, ..."
Fox News Can’t Stop Talking About Bernie Sanders,"Fox News loves talking about Bernie Sanders. Every week since the Vermont senator launched his 2020 campaign, Fox News has outstripped MSNBC and ..."
AIPAC Targets Bernie Sanders in Facebook Ads Focused on Key Democratic Primary States,"Bernie Sanders is the target of an ad campaign on Facebook paid for by the American Israel Public Affairs Committee, the pro-Israel lobbying group."
Bernie Sanders v the Democratic establishment: what the battle is really about,Sanders is sparking a debate within the Democratic party about whether courting big dollars is the only way to stay competitive. Bernie Sanders speaks during a ...
Here's How Bernie Sanders Earned Nearly $5 Million In The Past 10 Years,"Bernie Sanders has had a good decade. Since 2009, the socialist senator has pulled in nearly $5 million in income, according to a Forbes analysis of 10 years ..."
Bernie Sanders unveils trade platform challenging Trump's China policy,"Sanders' platform is a jab at President Donald Trump, who pledged to overhaul U.S. trade deals but has has struggled to fully follow through on his promise."
New Bernie Sanders App Democratizes Organizing — and Panics People Unfamiliar With Organizing,"The Bernie Sanders campaign kicked off its massive volunteer program this weekend by holding nearly 5,000 house parties across the country and unveiling a ..."
Sanders sharpens the choice Democrats face on health care,Congressional Democrats are locking arms to protect the Affordable Care Act -- the party's signature achievement during Barack Obama's presidency -- as ...
Bernie Sanders: Here's what has to change in South Carolina and the nation,Democratic presidential contender Bernie Sanders writes an op-ed in advance of his visit to the Upstate Thursday and Friday.
Bernie Sanders would sign reparations research bill if elected president - Business Insider,"""If the House and Senate pass that bill of course I would sign it...There needs to be a study,"" Sanders said on Friday."
Sanders launches mega volunteer program,Bernie Sanders' campaign will unveil a slate of top hires and organizing kickoff events Wednesday — the latest sign that he plans to harness his record-breaking ...
Bernie Sanders declines to say when he will release tax returns,"Democratic presidential candidate Sen. Bernie Sanders sidestepped questions Thursday about when he will release his tax returns, with the Vermont ..."
Joe Biden challenges Bernie Sanders 2020 Democrat frontrunner status - Business Insider,Sen. Bernie Sanders' status as the early 2020 Democratic frontrunner could face its first serious challenge now that former Vice President Joe Biden has hopped ...
1 thing that Sanders has changed his mind about,"During a CNN town hall, Democratic presidential candidate Sen. Bernie Sanders discusses a policy position that he has changed his mind on recently."
Bernie Sanders’s foreign policy: end inequality and authoritarianism,His foreign policy features ending income inequality and starting a global democratic movement against oligarchy and authoritarians.
Riding Through The Rust Belt With Sen. Bernie Sanders,"Sen. Bernie Sanders of Vermont is back on the presidential campaign trail, and he's focusing on states that went for Donald Trump in the 2016 election ."
Student asks Bernie Sanders about 'failures of socialism',"During a CNN town hall, a student whose family fled Soviet Russia asked Democratic presidential candidate Bernie Sanders about the ""failures of socialism"" ..."
Bernie Sanders Is Making Union Solidarity an Essential Theme of the 2020 Campaign,The senator is rallying with labor and proposing to upend “right to work” laws.
"Bernie Sanders backs Ilhan Omar again, but says she could do 'a better job' addressing Jewish community","Sen. Bernie Sanders on Monday night defended Rep. Ilhan Omar, one of the first Muslim women to serve in Congress, against ""outrageous, racist"" attacks, while ..."
"Bernie Sanders town hall on Fox News: Now a millionaire himself, Sanders says he won't apologize for writing bestselling book",The Vermont senator defended his earnings and insisted he does not attack the wealthy on Fox News' town hall.
Poisoned Press: The original plot to stop Bernie Sanders … and why it didn’t work,Bernie Sanders celebrates his Burlington mayoral win in 1981. File photo. This news analysis is by longtime Vermont journalist Greg Guma. He writes about ...
Bernie Sanders and the Myth of the 1 Percent,"A peculiar chapter in the 2020 presidential race ended Monday, when Bernie Sanders, after months of foot-dragging, finally released his tax returns. The odd ..."
Bernie Sanders Has a Message for Trump on Trade,"As workers' rights have become a focus for the 2020 presidential campaigns, Senator Bernie Sanders has called on President Donald Trump to protect those ..."
Can taxing the rich pay for Bernie Sanders' Medicare for All plan?,"Vermont Sen. Bernie Sanders is not hiding the fact that everyone's taxes would go up under his ""Medicare for All"" plan, though the rich would be hit with several ..."
Bernie Sanders can't beat Donald Trump in 2020: Obama campaign manager Jim Messina,"Jim Messina, who managed President Barack Obama's re-election campaign, says he does not think that Sen. Bernie Sanders can overtake President Donald ..."
Why women of color booed Bernie Sanders at a recent speech,"Earlier this week, Sen. Bernie Sanders (I-Vt.) spoke of marching with the Rev. Martin Luther King Jr. It was a testament, he said, to his long history advocating for ..."
Bernie Sanders is hypocritical on most significant campaign issues | TheHill,The presidential candidate does not practice what he preaches on economics and other issues.
"Sen. Sanders: I am 100% pro-Israel, but ...",Democratic presidential candidate Sen. Bernie Sanders shares whether he will maintain a strong US-Israel alliance despite his criticisms of Israeli Prime ...
Bernie Sanders Is Getting A Shadow Organizing Campaign In The Midwest,Our Revolution will work to amplify Sanders' message in the Midwest as he builds the case that he's the best candidate to beat Donald Trump.
Senator Bernie Sanders Calls Trump a 'Racist',"Sen. Bernie Sanders made a trip to the Apollo Theater in Harlem to pay tribute to Harry Belafonte, Tony Bennett and the legacy of the Rev."
Sanders gets endorsements from 7 black S. Carolina lawmakers,"SPARTANBURG, S.C. (AP) — Democratic presidential candidate Bernie Sanders on Thursday announced endorsements from seven black lawmakers in the ..."
"Lumping Bernie Sanders into 'old, white male' category discounts his Jewishness","To cast Bernie Sanders, whose father immigrated to the United States to escape antisemitism in Europe, as just another privileged old white male running for ..."
Bernie Sanders lays out his vision for 'Medicare for All',"At a CNN town hall moderated by CNN's Chris Cuomo, Sen. Bernie Sanders (I-VT) discusses his plan to replace private insurance with single payer healthcare."
Note to Bernie Sanders: Capitalism works,"Is it possible a richer Sanders may finally get it that capitalism is a great thing, that inequality is not what makes or keeps people poor and that free trade has ..."
Political cartoons: “Crazy Bernie” Sanders,"Crazy Bernie, Creepy Joe and other familiar comics."
Democratic presidential candidate Bernie Sanders to make first Sioux City stop of 2019,SIOUX CITY -- U.S. Sen. Bernie Sanders will make his first Sioux City presidential campaign stop of the 2020 cycle on Sunday.
Bernie Sanders bringing presidential campaign to Houston,BERNIE IN HOUSTON: The Democratic senator will make a campaign stop at Discovery Green Wednesday and wants you to be there.
‘Bring it on’: Biden and Sanders teams kick off debate over Medicare-for-all,"Joe Biden on Monday endorsed a public option that would allow all Americans to buy into a Medicare-like health insurance plan, as allies of both the former vice ..."
Bernie Sanders is now a millionaire. Can he still speak for working-class Americans?,"Sen. Bernie Sanders (I.-Vt.) is running for president as an advocate for working-class Americans. But in a recent New York Times interview, the self-proclaimed ..."
Warren puts Bernie on defense - POLITICO,The Massachusetts senator is aggressively pitching policies in Sanders' wheelhouse.
Bernie Sanders opposes US military intervention in Venezuela - Business Insider,"""At the end of the day, I think what you want in one of the largest countries in Latin America is free and fair elections."""
All Bernie’s Socialists,The candidate's advisers want America to be more like Venezuela.
Bernie Sanders in Warren: Trump 'mistake is not going to be repeated',Bernie Sanders is going after Donald Trump and he made the clear during a stop in Warren Saturday evening.
The Rematch: Bernie Sanders vs. a Clinton Loyalist,The blowup reflects ideological divisions among Democrats between a legacy Clinton organization and liberals trying to harness the energy of millennials.
Bernie Sanders 'central' to Russia's pro-Trump 2016 strategy: study - Business Insider,"""There is no question that Sanders was central to their strategy. He was clearly used as a mechanism to decrease voter turnout for Hillary Clinton."""
Bernie Sanders: This could work toward Trump's advantage,"During a CNN-sponsored town hall, Sen. Bernie Sanders showed that his presidential candidacy will be about more than questioning the Mueller report and ..."
Elizabeth Warren is the star who may eclipse Bernie Sanders,"During Monday night's CNN town halls, Elizabeth Warren outshone the seasoned progressive to whom she's often compared. While Bernie Sanders made his ..."
"Bernie Sanders takes on energy industry in Houston, not the workers",Sen. Bernie Sanders pledged to thousands of Houstonians on Wednesday that a proposed green energy stimulus package would not burn workers in the ...
"President Trump, Sen. Bernie Sanders Are Front-Runners In The Money Race For 2020","As presidential hopefuls enter the Democratic primary contest, they have to figure out how to raise the money they need, and the different options available."
"The Daily 202: Tax returns show 2020 candidates gave to charity, but not a ton",With Joanie Greve and Mariana Alfaro. THE BIG IDEA: Former congressman Beto O'Rourke (D-Tex.) released 10 years of tax returns last night. He and his wife ...
Bernie Sanders trolls Donald Trump's visit to Wisconsin,MADISON - U.S. Sen. Bernie Sanders is seeking to defend his friendly turf in Wisconsin against a second win by President Donald Trump in 2020 by tying job ...
Bernie Sanders Talks GM And Education In Lordstown Stop,"Vermont Senator and presidential candidate Bernie Sanders was in Lordstown yesterday for a town hall on education, the economy and how they're tied to the."
Here's How Bernie Sanders Missed the Mark at She the People,The audience lost patience when Sanders deflected on two questions his team should have been prepared to address.
"GOP Sen. Rick Scott: 'If you like Bernie Sanders, why don't you go ahead and move to Caracas?'","Sen. Rick Scott, R-Fla., on Wednesday took a shot at Democratic presidential contender Sen. Bernie Sanders, saying people who intend to vote for the Vermont ..."
"Bernie Sanders releases tax returns, showing million-dollar years",Senator Bernie Sanders released a decade's worth of his tax returns after years of resisting disclosure as he makes a second run at the presidency against ...
Ann Coulter says she would vote for Bernie Sanders – if he 'went back' to immigration stance,"Conservative provocateur Ann Coulter often makes headlines by caustically deriding political figures, but she drew attention Wednesday by saying nice things ..."
Joe Biden advisers mad at Bernie Sanders team over allegations: report - Business Insider,People close to former Vice President Joe Biden say they are suspicious that Bernie Sanders is involved in the accusations that he inappropriately touched ...
Sen. Bernie Sanders challenges Sen. Amy Klobuchar in her home state,"Vermont Sen. Bernie Sanders, who won Minnesota's last Democratic presidential caucuses, isn't ceding the state's 2020 primary to Sen. Amy Klobuchar."
Bernie Sanders raises most 2020 campaign cash in North Carolina,"Bernie Sanders raised at least $48,000 from donors in North Carolina during the first three months of the year, the most of any other Democratic presidential ..."
Bernie Sanders faces lively audience in Bethlehem town hall,"Fox News was the one hosting the Monday night town hall for Bernie Sanders in the Lehigh Valley, but it was the hosts who faced more backlash from the ..."
Bernie Sanders seeks override of Trump's Yemen veto,"WASHINGTON — To override President Donald Trump's veto of a measure to end U.S. military support for Saudi Arabia's war in Yemen, Sen. Bernie Sanders ..."
Bernie Sanders beat Beto O'Rourke in a key fundraising measure,"Washington (CNN) The monster $6.1 million haul that Beto O'Rourke touted in the first day of his presidential campaign included nearly $300,0000 that he can't ..."
"Bernie Sanders: Everyone deserves to vote, even felons like Paul Manafort & Michael Cohen",Committing a serious crime shouldn't strip people of their basic right to be a citizen and active participant in our democracy.
Sander-nista? Archives show Bernie’s past praise of socialist revolutionaries,"Bernie Sanders, a front-runner for the Democratic presidential nomination, has long billed himself as a democratic socialist, citing the peaceful governments of ..."
Why the ‘millionaire’ dig on Bernie Sanders isn’t as powerful as it once might have been,America learned late last week that Sen. Bernie Sanders (I-Vt.) would soon release tax returns that showed his income topping $1 million after his 2016 ...
Photos: Bernie Sanders kicks off 2020 presidential campaign tour in Madison,"Democratic 2020 presidential candidate Bernie Sanders speaks at the podium during a rally at James Madison Park in Madison, WI on Friday, April 12, 2019."
Is Sanders still credible to rally against millionaires?,"During a CNN town hall, Democratic presidential candidate Sen. Bernie Sanders addresses concerns that his financial status as a millionaire undermines his ..."
Bernie Sanders brings a more welcoming message,"U.S. Sen. Bernie Sanders addresses a crowd of 4,500 Sunday at a campaign rally in Schenley Park. (Current Photos by Jake Mysliwczyk) ..."
Cory Booker swipes at Bernie Sanders over restoring voting rights for felons in prison,"Sen. Cory Booker on Monday called out Sen. Bernie Sanders over his support for restoring voting rights to convicted felons still serving prison time, drawing a ..."
Bernie Sanders First to Sign Pledge to Rally Behind Democratic Nominee,The pledge was launched this morning by Indivisible.
Beto O'Rourke staffers in Texas who flipped to Bernie Sanders explain why,Their journey reveals a major fault line for O'Rourke as he transitions from a statewide campaign in which occasional votes with the Republicans can be an ...
"Bernie Sanders wants you to expose your friends, Facebook-style","The Democratic candidate launches an app that asks users to snitch on the political beliefs of family, friends, and even strangers."
Lindsey Graham rejects Bernie Sanders' idea that felons should be allowed to vote,"U.S. Sen. Lindsey Graham rejected Democratic presidential hopeful Bernie Sanders' stance that prison inmates should be allowed to vote, saying it would allow ..."

Here's how Bernie Sanders made his millions — and why it matters in the 2020 election,"Book income helped self-proclaimed socialist Bernie Sanders join the millionaire class, a group he has often criticized during his decades in politics."
The incredible shrinking ... Bernie Sanders?,"Concord, New Hampshire (CNN) Last go-round, New Hampshire was everything to Bernie Sanders, his one sure thing as he battled Hillary Clinton for the ..."
Bernie Sanders Tries to Reclaim the Insurgency,"In New Hampshire this week, the candidate who became known for turning out thousands pivoted to a series of intimate gatherings."
Bernie Sanders becomes latest 2020 candidate to call for Facebook breakup,"On Capitol Hill yesterday, Sen. Bernie Sanders (I-VT), a Democratic frontrunner, told Politico that he supports calls like those from his colleague and presidential ..."
‘I Did My Best to Stop American Foreign Policy’: Bernie Sanders on the 1980s,"In an interview, one of the leading candidates for the 2020 Democratic presidential nomination discusses his long-held opposition to war and his support for ..."
The Secret of Bernie’s Millions,How did he amass three houses and a net worth of more than $1 million? The surprisingly conventional middle-class climbing of a radical-sounding socialist.
"Bernie Sanders, a Front-Runner With Financing to Prove It, Struggles to Retain Outsider Status",The candidate who blasted the campaign-finance system as 'corrupt' has drawn support from outside groups with few restrictions and undisclosed donors.
The Transformation of Bernie Sanders,How the Vermont senator went from a third-party independent to a 2020 frontrunner.
Sanders backs calls to break up Facebook,"Sen. Bernie Sanders (I-Vt.) said today he supports calls to break up Facebook, his first remarks on the matter since entering the 2020 Democratic presidential ..."
Bernie Sanders rolls out comprehensive education plan,Vermont Sen. Bernie Sanders unveiled his education policy plan on Saturday -- a comprehensive 10-point agenda that calls for the end of for-profit charter ...
Bernie Sanders backs 2 policies to dramatically shift corporate power to U.S. workers,"Sen. Bernie Sanders (I-Vt.) will push new policies aimed at giving workers a greater ownership stake in companies, moves the 2020 presidential candidate is ..."
Bernie Sanders slams Joe Biden for downplaying China's economic threat to the US,Sen. Bernie Sanders takes an apparent shot at former Vice President Joe Biden over comments he made downplaying the economic threat China poses.
Mayor and ‘Foreign Minister’: How Bernie Sanders Brought the Cold War to Burlington,"BURLINGTON, Vt. — For Daniel Ortega, the president of Nicaragua, the summer of 1985 was to be a moment of extraordinary triumph. In July, on the sixth ..."
Matt Taibbi on the Trail With Bernie Sanders 2.0,"Listen to an audio version of this story below: Madison, Wisconsin. A blustery Friday evening. A few thousand supporters of Vermont senator and presidential ..."
The making of Bernie Sanders: How a hitchhiking campaigner pushed a vision that remains remarkably unchanged,"He slept on a friend's couch, hustled for odd jobs and hitchhiked along the campaign trail."
"Bernie Sanders employee ownership plan, explained",He wants to mandate employee ownership of big companies.
Bernie Sanders will attend Walmart's annual meeting to push for higher pay and other labor reforms,"Sanders plans to introduce a measure that would give hourly Walmart workers a seat on the retailer's board, according to The Washington Post."
Can Bernie Sanders change his luck in the South?,"OPINION — Bernie Sanders spent the weekend on a Southern swing, which makes sense. The Vermont senator's failure to connect with enough core ..."
'I need you after I am president': Bernie Sanders to Asheville during 2020 election rally,"Once derided as a radical, Sen. Bernie Sanders told an Asheville rally that his ideas, such as universal health care, are now the norm."
