title,media
Local organizers for Bernie Sanders to open Wilkes-Barre office,WILKES-BARRE — Supporters of Democratic presidential candidate Bernie Sanders will soon open a Wilkes-Barre campaign office. Ahead of the national ...

"Bernie Sanders Is Hospitalized, Raising Questions About His Candidacy","Senator Bernie Sanders was recovering in a Las Vegas hospital on Wednesday after being treated for blockage of an artery, forcing him to cancel his events in ..."
'I Think We're Gonna Win This Thing': Sen. Bernie Sanders On 2020 Campaign,Sen. Bernie Sanders thinks he's going to win the Democratic nomination. The Independent senator from Vermont is running for president on a platform pushing ...
Bernie Sanders’ Campaign Is Looking Strong. But Can He Grow His Base?,"Sen. Bernie Sanders stood on a stage in Iowa City's pedestrian mall staring out at a crowd of more than 1,300 on Friday night. It was a cold autumn night, and his ..."
How Bernie Sanders' heart attack changes the 2020 race,Bernie Sanders' heart attack suffered on the campaign trail last week thrusts a tough issue to the front of the 2020 presidential race: How old is too old to be ...
"Bernie Sanders Had Heart Attack, His Doctors Say as He Leaves Hospital","Senator Bernie Sanders had a heart attack this week, his presidential campaign said on Friday as he left a Las Vegas hospital, following three days of near ..."
Bernie Sanders to scale back campaign schedule in the wake of heart attack,"Burlington, Vermont (CNN) Sen. Bernie Sanders said Tuesday he is prepared to change the nature of his presidential campaign after seeing a cardiologist in his ..."
How Bernie Sanders' Campaign Is Proving Resilient,"About three weeks ago, Vermont Sen. Bernie Sanders had a heart attack that threw his campaign into question. But now, it's more apparent than perhaps at any ..."
Bernie Sanders Leverages the Debate for a Comeback Just Weeks After a Heart Attack,"Two weeks after he suffered a heart attack, Bernie Sanders was lively and sharp at the October Democratic debate on topics from impeachment to health care."
"Bernie Sanders on socialism, taxes and why he thinks fossil fuel executives are 'criminals'","Bernie Sanders, in a wide-ranging chat with CNBC's John Harwood, discusses personal issues, his economic agenda and his hope to become a 21st century ..."
Bernie Sanders Says He Will Slow His Campaign Pace After Heart Attack,"BURLINGTON, Vt. — Senator Bernie Sanders, in a striking concession for a leading presidential candidate, said on Tuesday that he planned to slow down his ..."
"‘I Am Back’: Bernie Sanders Addresses 26,000 With Alexandria Ocasio-Cortez","Democratic presidential candidate Bernie Sanders addressed a raucous crowd on Saturday as he showcased two high-profile progressive endorsements, Rep."
Bernie Sanders says he's back. Is he?,"Despite what he's said, Bernie Sanders is not actually scaling back the campaign, telling NBC News that he ""misspoke."""
"Sen. Bernie Sanders to be endorsed by Rep. Alexandria Ocasio-Cortez, an influential voice among young liberals","Rep. Alexandria Ocasio-Cortez of New York, one of the most influential voices among young liberals and a rising Democratic star, plans to endorse Sen. Bernie ..."
"After Health Scare, Bernie Sanders Is Back And Campaigning Hard In New Hampshire","Despite suffering a heart attack earlier this month that halted his campaign for two weeks, Vermont Sen. Bernie Sanders is raising big money, attracting huge ..."
Bernie Sanders to slow campaign pace after heart attack,Presidential candidate Bernie Sanders said Tuesday that he plans to scale back his campaigning after suffering a heart attack last week in Las Vegas.
What Jane Sanders Is Telling Bernie Sanders About His 2020 Bid,"BURLINGTON, Vt. — When it comes time to make critical decisions regarding his presidential campaign, Senator Bernie Sanders often relies on a committee of ..."
Bernie Sanders takes aim at fellow Democrats,"On a recent “Saturday Night Live,” Bernie Sanders (played by Larry David) exclaimed, “l'm so excited to be back and to ruin things a second time.” The audience ..."
"Bernie Sanders felt symptoms for weeks, will release medical records","Sen. Bernie Sanders told CNN on Thursday that he felt symptoms weeks ahead of his heart attack that he ""should have paid more attention"" to, and he will ..."
Bernie Sanders had a heart attack. He's returning to Vermont to recover,"Democratic presidential candidate Sen. Bernie Sanders suffered a heart attack, his campaign confirmed on Friday after he departed Desert Springs Hospital ..."
Bernie Sanders to slow 2020 election campaign after heart attack,Bernie Sanders has told reporters he could slow the pace of his campaign for the presidency after suffering a minor heart attack. The 78-year-old Vermont ...
Bernie Sanders says he was ‘dumb’ to ignore his symptoms,"Sen. Bernie Sanders, off the campaign trail and resting at home until next week's Democratic debate, said Tuesday he had been “dumb” to ignore symptoms that ..."
Bernie Sanders' heart attack raises questions about candidates' ages. Here's what experts say.,"The Vermont Senator had a mild heart attack and had two stents inserted in his coronary arteries, bringing questions about age and the presidency to the fore."
The Return of Bernie Sanders Is Bigger Than Bernie Sanders,"To the senator's superfans watching last night's debate, the promise of a political revolution is well worth supporting a 78-year-old who just had a heart attack."
"Bernie Sanders had a heart attack, campaign says","Democratic presidential candidate Sen. Bernie Sanders suffered a heart attack, his campaign confirmed after he departed Desert Springs Hospital Medical ..."
Education field gives more to Bernie Sanders than other 2020 Democrats,"Amid a push for education reform, Bernie Sanders is leading the Democratic 2020 candidates in fundraising from the education field."
Bernie Sanders wants to give workers an ownership stakes in big companies,Sen. Bernie Sanders on Monday introduced a series of proposals designed to radically realign the balance of power in the American economy.
"Bernie Sanders undergoes unexpected heart procedure, postpones campaign events for at least a few days","LAS VEGAS — Democratic presidential contender Bernie Sanders was treated for an artery blockage this week, sidelining him for at least a few days from a race ..."
Bernie Sanders draws contrast with Elizabeth Warren: She says 'she is a capitalist through her bones. I'm not.',"With Sen. Elizabeth Warren climbing in polls, Sen. Bernie Sanders highlighted a key difference in their core economic philosophies in an interview on ABC's ..."
Bernie Sanders defends Tulsi Gabbard: 'Outrageous' to suggest she is a foreign asset,Democratic presidential candidate Sen. Bernie Sanders on Monday defended his fellow 2020 hopeful Rep. Tulsi Gabbard of Hawaii against the claim that she is ...
Bernie Sanders throws in the towel on explaining how to fund Medicare-for-all,Democratic presidential candidates criticizing Medicare-for-all have taken to chastising Sen. Elizabeth Warren (D-Mass.) for not explaining how she will fund the ...
Bernie Sanders speaks for first time after heart attack,"Presidential candidate Sen. Bernie Sanders (D-VT) speaks on camera, for the first time since he was hospitalized after suffering a heart attack, while on a walk ..."
Bernie Sanders tops third-quarter money race in New Hampshire,"Vermont U.S. Sen. Bernie Sanders topped the third-quarter money race among Democratic presidential hopefuls in New Hampshire, edging out Massachusetts ..."
Sanders allies urge him to slow down and show a personal side in the aftermath of his heart attack,"As Bernie Sanders recovers from a heart attack, friends and allies say he should talk about himself more and curtail campaign events — a big change from what ..."
Bernie Sanders receives enthusiastic reception at Latino presidential town hall in Iowa,"Among the four participating presidential candidates at a televised Latino town hall in Des Moines, U.S. Sen. Bernie Sanders of Vermont received the most ..."
Bernie Sanders speaks on camera about his health after his heart attack - Business Insider,"Sen. Bernie Sanders said he is recovering well from the heart attack he suffered earlier this month, and is looking forward to getting back to campaigning ahead ..."
"Bernie Sanders, Elizabeth Warren Lead Democratic Fundraising, While Biden Lags",Sens. Bernie Sanders and Elizabeth Warren are showing they will have the money to be around for some time. Former Vice President Biden lagged behind with ...
Backlash Against Bernie Sanders and Ocasio-Cortez in Queens,"Wednesday: Bernie Sanders's Saturday rally was across the street from the Queensbridge Houses, and some residents said they weren't invited."
Sanders gets personal in a conversation about Israel policy,"At a convention for the liberal Jewish organization J Street, Sanders said his faith and background make it easier for him to criticize Israel."
2020 Daily Trail Markers: Bernie Sanders takes a break after health scare,"According to recent CBS News battleground polling, the majority of Democrats in early voting states said that age is not a concern."
Bernie Sanders’s plan would force country’s largest corporations to share profits with workers,"The day before a debate where Sen. Bernie Sanders will make his first formal appearance since his recent heart attack, he released a plan on “corporate greed ..."
Bernie Sanders says this is what sets him apart from Warren,"In an interview with ABC's ""This Week,"" presidential candidate Bernie Sanders discusses what sets him apart from fellow Democratic candidate Elizabeth ..."
Presidential Hopeful Bernie Sanders Undergoes Procedure for Blocked Artery,U.S..
Bernie Sanders Says He Knew of Heart Attack Three Days Before Disclosing It,"Bernie Sanders acknowledged on Wednesday that he knew he had suffered a heart attack three days before his campaign released that information, but he ..."
Bernie Sanders to take on DNC over convention funding,"As Democratic presidential candidate Sen. Bernie Sanders recovers from a heart attack at home in Burlington, Vermont, his campaign continues by releasing a ..."
Bernie Sanders to launch his first 2020 TV ad in Iowa,"Sen. Bernie Sanders will launch his first television ad of the 2020 cycle in Iowa, the campaign announced Tuesday."
"Bernie Sanders backtracks, says his campaign won’t slow down after heart attack",Democratic presidential candidate Bernie Sanders said Wednesday that he “misspoke” when he told reporters he may slow his frenetic campaigning pace after ...
‘A Prophet’: The Zeal of Bernie Sanders Supporters,"As the candidate returns to the campaign trail, Democratic Party leaders are asking whether his supporters are loyal to the party, or just to him."
Bernie Had a Heart Attack. We Need To Talk About That.,"What's worse: Bernie Sanders' heart attack, or the fact he's not being candid about it?"
"Racism, Bernie Sanders and the limits of 'respect'","Washington (CNN) It was a study in contrasts. Over the weekend, at the Second Step Presidential Justice Forum hosted at the historically black Benedict College ..."
Opinion: It's time for Bernie and his bros to get behind Elizabeth Warren,"You know, I do love me some Bernie Sanders. But he should stand down and fully support the strongest Democratic candidate with an agenda closest to his: ..."
"Rashida Tlaib joins Ocasio-Cortez, Omar in endorsing Bernie Sanders",Michigan Rep. Rashida Tlaib endorsed Sen. Bernie Sanders for president at a rally in Detroit on Sunday night. She joins Rep. Alexandria Ocasio-Cortez of New ...
Bernie Sanders files candidacy in New Hampshire,Vermont Senator Bernie Sanders Thursday officially filed his paperwork and paid the $1000 fee to get on the presidential primary ballot in New Hampshire.
Bernie Sanders picks up endorsement from AOC,"Sen. Bernie Sanders returned to the campaign trail in New York for a rally with Rep. Alexandria Ocasio-Cortez, who delivered an endorsement for his 2020 bid."
Bernie Sanders: ‘The difference between Trump and me is he lies’,"Sen. Bernie Sanders has pledged to end “endless wars” — but on Sunday, the presidential hopeful was quick to put distance between his vision for American ..."
Bernie Sanders changes Mpls campaign rally venue,Sanders and Rep. Ilhan Omar will now stage the event on Nov. 3 at Williams Arena on the University of Minnesota campus.
Ariana Grande tweeted 'baby how u feelin'? Bernie Sanders responded,"When Ariana Grande tweeted, ""baby how u feelin,"" Bernie Sanders responded with ""Ready to fight for Medicare for All."""
Recuperating Sanders says he may slow down campaigning pace,"BURLINGTON, Vt. (AP) — Bernie Sanders began reintroducing himself to the 2020 campaign on Tuesday, venturing outside his Vermont home to say that he ..."
Fact Checker: Was Bernie Sanders the first to urge 'Medicare for all?',Introduction'He was the first candidate to stand up and demand affordable health care for everyone through Medicare for all.'
"Bernie Sanders heart attack: San Juan mayor, top Sanders surrogate, fiercely defends candidate's health","""If there was something to be concerned about, he would have been open with the American people,"" said San Juan Mayor Carmen Yulín Cruz."
Bernie Sanders may make 4-day workweek part of 2020 campaign platform - Business Insider,Sanders' openness to cutting the number of hours in the workweek of Americans could transform the debate around an issue at the fringe for decades.
Warren and Sanders outraise the rest in Silicon Valley – despite bashing big tech,"Sanders and Warren want to break up the industry. That has not dented their popularity with its workers, Guardian analysis finds."
Bernie Sanders On Corporate Democracy,"This week Senator and leading presidential candidate Bernie Sanders unveils his eagerly awaited corporate reform plan. As anticipated, it is one of the two most ..."
CNN Poll: Sanders and Warren fight for home field in New Hampshire,Vermont Sen. Bernie Sanders (21%) and Massachusetts Sen. Elizabeth Warren (18%) are in a close race among likely voters in New Hampshire's ...
These Oregon residents gave the most to Bernie Sanders in 2019,The Vermont senator has raised the most money in Oregon among the Democratic candidates for president.
Bernie Sanders and the 2020 age debate,"With only 120 days until the Iowa caucuses, the 2020 election will be here before you know it. Every Sunday, I round up the 5 BIG storylines you need to know to ..."
2020 presidential hopeful Sen. Bernie Sanders to open Rock Hill office,"Vermont Senator and Democratic presidential candidate Bernie Sanders will open a campaign office in Rock Hill, South Carolina, on Cherry Road."
Bernie Sanders unveils plan to tackle 'corporate greed and corruption' - Business Insider,Sen. Bernie Sanders rolled out a new plan on Monday that would impose sweeping rules compelling the nation's largest companies to share ownership and ...
"Second Step Presidential Justice Forum: Bernie Sanders: Respect police officer ""so that you don't get shot in the back of the head""","At the Second Step Presidential Justice Forum at Benedict College, Sanders told a black college student to be ""polite"" if he gets pulled over."
Ben Emery: Bernie Sanders administration would be revolutionary,For 2020 there is a most unlikely revolutionary candidate running for President of the United States of America. This is a political revolutionary candidate. Bernie ...
Will Medicare-for-all hurt the middle class? Elizabeth Warren and Bernie Sanders struggle with questions about its impact.,Health-care experts say the middle-class Americans could pay more under plans backed by the senators that are meant to lessen their costs.
Bernie Sanders joins Elizabeth Warren in criticizing Amazon’s spending in Seattle City Council elections,"Sanders called Amazon's $1.5 million in contributions to a PAC associated with the Chamber of Commerce ""a perfect example of the out-of-control corporate ..."
Sanders to scale back campaign events after heart attack,2020 Democratic presidential candidate Sen. Bernie Sanders said he is prepared to change the nature of his presidential campaign after seeing a cardiologist in ...
'Personality Is a Huge Part of It.' A Look Inside the Mystery of the Bernie-to-Pete Voter,"Laura Hubka remembers experiencing a political conversion the first time she heard Bernie Sanders speak. “I just fell in love with him,” says the chair of the ..."
Bernie Sanders to Participate in Debate After Heart Procedure,"Bernie Sanders will be on stage at the Democratic debate in Ohio on Oct. 15 following a heart procedure that took him off the campaign trail, aides said on ..."
The unexpected threat emerging against Bernie: Andrew Yang,"Andrew Yang snatched up Bernie Sanders' 2016 ad firm last week, a coup for the long-shot presidential contender that raised eyebrows in political circles."
Bernie Sanders releases marijuana legalization plan that includes billions in federal grants,BURLINGTON – Sen. Bernie Sanders has released a plan for marijuana legalization that would invest tax revenue in grants for minority-owned cannabis ...
OPINION: Bernie Sanders isn't going anywhere,"Despite health problems, Sanders is ready to take on the presidential campaign."
The 'Bernie Sanders Slate': outsiders back Seattle Council candidates,"Sen. Bernie Sanders, I-Vermont, has yet to set foot in Washington during his 2020 run for the Democratic presidential nomination, but has freely tweeted his ..."
"Reality check, Midwestern moderates: Your states love Bernie Sanders","In 2016 Bernie Sanders won in Indiana and Minnesota, two states whose presidential candidates are running as moderate Democrats."
Bernie Sanders' Heart Troubles Raise The Topic Of Age,The top Democratic presidential candidates are all 70 years old and older.
Bernie Sanders's $97 Trillion Agenda Would Impose Incomprehensible Costs.,"It's been a difficult time for Senator Bernie Sanders, who was hospitalized two weeks ago after suffering a heart attack and whose 46-year-old daughter-in-law ..."
Debate Profile: Bernie Sanders,Senator Bernie Sanders is running for the Democratic Presidential nomination for the second time. Senator Sanders recently announced he raised $25. 3 million ...
Bernie Sanders answers questions about LGBTQ issues,"In an interview with CNN's Dr. Sanjay Gupta, Sen. Bernie Sanders discusses not being able to attend the CNN LGBTQ town hall."
"Week In The News: Impeachment Inquiry, Facebook, Sen. Bernie Sanders, More",President Trump's inner circle under fire as the impeachment inquiry heats up. Sen. Bernie Sanders sidelined by a heart procedure. Facebook vs. Sen.
Bernie Sanders released from hospital following heart attack,"Sen. Bernie Sanders' presidential campaign said this week that he will participate in the next Democratic primary debate on Oct. 15 in Westerville, Ohio, after ..."
"Teachers for Bernie, CEOs for Buttigieg, retirees for Trump – who's backing whom in 2020",A Guardian analysis of presidential candidate fundraising reports reveals who is winning over which popular professions.
'Barrio cred': Bernie banks on Latinos for primary breakout,"DES MOINES, Iowa — Bernie Sanders has “barrio cred.” That might sound like a crazy thing to say about the 78-year-old senator from one of the whitest states ..."
Rep. Rush: ‘egotistical’ for bernie Sanders to continue presidential bid if heart attack compromised health.,"Rush, who chairs the Illinois Kamala Harris campaign, told the Sun-Times he is not calling for Sanders to drop out. 'I am just saying that it is pretty arrogant, ..."
The pundit class continues to misunderstand Bernie Sanders – and it shows,"Sanders returns again and again to issues that matter to ordinary people: healthcare, student debt and climate change – issues which are not a priority for the ..."
Jack White set to perform at Bernie Sanders rally Sunday in Detroit,"The Bernie Sanders rally will be held at Cass Tech in Detroit, Jack White's alma mater, and will see an appearance by Rep. Rashida Tlaib."
A viral video landed him a job on the Sanders campaign. His resignation highlights the pitfalls of the quest for digital dominance.,"The five-minute video features a parade of cable pundits, interspersing their harsh disapproval of Bernie Sanders with flattering clips of the senator from Vermont ..."
Bernie Sanders Discharged From Hospital After Heart Attack,"Democratic presidential candidate Bernie Sanders was discharged from a Nevada hospital on Friday, and his campaign disclosed that he had suffered a heart ..."
Two Stents Implanted in Democratic Presidential Candidate Bernie Sanders,"October 2, 2019 — Democratic presidential candidate Sen. Bernie Sanders (D-VT) was hospitalized with chest pain on Oct. 1 and went to the cath lab to have ..."
Bernie Sanders slams GOP for not standing up to Trump,"Sen. Bernie Sanders (I-VT) appeared on ""Jimmy Kimmel Live,"" where he shared his thoughts on the Republican's response to the impeachment inquiry into ..."
An open letter to Bernie Sanders: Please bring your 2020 presidential campaign to Cascadia,"NPI founder Andrew Villeneuve, a 2016 National Delegate for Bernie Sanders, urges the Senator to make a visit to Cascadia an immediate priority."
"Bernie Sanders is right, it’s time to redistribute economic power","His bold plan would transform how companies operate and for whom, says Mathew Lawrence of the thinktank Common Wealth."
Bernie Sanders Is Now Facing Something He Hates: Physical Limitations And A Focus On Himself,"Sanders, who is in the hospital after doctors discovered a blocked artery, has always loathed physical illness — and been aware of how a candidate's health can ..."
"Bernie Sanders wants 'criminal' CEOs locked up, but lawyers say that's unlikely to happen","In a wide-ranging interview with CNBC's John Harwood, Bernie Sanders ripped CEOs of Wall Street banks, as well as those of energy and pharmaceutical ..."
Bernie Sanders will not participate in LGBTQ town hall after heart attack,Clarification: A quote texted to USA TODAY about Bernie Sanders pulling out of the town hall was misattributed to the campaign. The story has been updated to ...
Sanders wins backing of prominent Iowa Democrat,"Linn County Supervisor Stacey Walker is set to endorse Sanders at the Vermont senator's rally in Iowa City, Iowa Friday night, NBC News has learned."

Bernie Sanders vs. The Machine,"In 1981, he was elected mayor of Burlington. But the city's bureaucracy showed him that winning wasn't everything. So he learned how to fight back."
Bernie Sanders Is Flush With Cash. Here’s How He Plans to Spend It.,WASHINGTON — Bernie Sanders's campaign plans to spend more than $30 million on TV advertising alone in the first four presidential nominating states and ...
"Believe it or not, Bernie Sanders is relaxing","Just weeks after a heart attack threw his campaign's future into doubt, Bernie Sanders is flashing glimpses of a more relaxed, funnier style. It's not clear if that's ..."
Bernie Sanders campaign pursues new voters in Iowa,The Bernie Sanders election machine is powered by the renewed zeal of his followers in the aftermath of his heart attack and the endorsement from Rep.
'From the bottom of my heart': Bernie Sanders bounces as health scare fades,"Des Moines, Iowa (CNN) Rep. Alexandria Ocasio-Cortez capped her debut on the Iowa hustings in support of Bernie Sanders last week with a blunt call to ..."
"Presidential hopeful Bernie Sanders visits Fresno, asks crowd to help ‘beat Trump’","Amid chants of “Bernie, Bernie,” Democratic presidential hopeful Sen. Bernie Sanders spoke Friday night before a large audience at Fresno City College."
"Why Bernie Sanders’ Heart, and Campaign, Will Go On","When Vermont Sen. Bernie Sanders suffered a heart attack in early October, it looked as if it might be the beginning of the end of an unsuccessful campaign for ..."
Bernie Sanders knocks Bloomberg's 2020 announcement,"Sen. Bernie Sanders on Sunday knocked Michael Bloomberg's decision to enter the 2020 race for the Democratic presidential nomination, saying his new ..."
Bernie Sanders hasn’t changed — and his supporters love that,"The senator's lack of compromise is a major draw for his supporters, and even for those who may have political differences with him."
Bernie Sanders 2020: He's looking beyond Iowa and New Hampshire to Super Tuesday states like California,"Manchester, New Hampshire – Bernie Sanders' campaign Manager Faiz Shakir aims to win the early-voting states, including Iowa and New Hampshire, but ..."
"Bernie Sanders wants to revamp trade deals, labor protections as part of sweeping immigration plan",Sen. Bernie Sanders would revamp North American trade relationships and expand protections for workers as part of a sweeping new immigration plan.
Bernie Sanders Finally Met Bernie Sanders (James Adomian),"In a clip from his podcast 'The Underculture,' comedian James Adomian, while doing his Bernie Sanders impression, sits down for a chat with the real Bernie ..."
Did New Hampshire Fall Out of Love With Bernie Sanders?,"FRANKLIN, N.H. — Bernie Sanders is more than happy to remind New Hampshire about his big win in the state's Democratic presidential primary almost four ..."
Bernie Sanders Is Still a Popular Progressive Presidential Candidate—But You Wouldn’t Know It From the News,"The senator was alone in calling for the abolition of ICE on Thursday, but like so many of his policies, it failed to break through as major news. He's also ..."
Bernie Sanders calls his plan to fund Medicare for All 'far more' progressive than Elizabeth Warren's,"Bernie Sanders, defending his Medicare for All approach against the newly-released plan from opponent Elizabeth Warren, is calling his way ""far more ..."
