title,media
Bernie Sanders pushes for drastic change to US economy: 'We need a political revolution',"Sen. Bernie Sanders, I-Vt., is in full force with his push for democratic socialism as he looks to increase support for his 2020 presidential campaign, and is calling ..."
Sanders on Warren's rise: People want a woman elected,Democratic presidential candidate Sen. Bernie Sanders attributed fellow candidate Sen. Elizabeth Warren's rise in the polls to the fact that some people want to ...
Bernie Sanders After Dark: Inside His First ‘Grass-Roots Fund-Raiser’,"Mr. Sanders held a small event at a nightclub, with tickets starting at $27, in a bid to keep his grip on small donors."
Joe Biden vs. Bernie Sanders: Second Debate Puts Rivals on Full Display,Poll front runners revival vs. revolution strategies highlighted during the second night of the Democratic debate.
‘In this together:’ Presidential hopeful Bernie Sanders preaches equality in Rock Hill,"Vermont US Senator Bernie Sanders visited Rock Hill, South Carolina, on Sunday for an event at Clinton College. He is campaigning throughout the early ..."
Everything Bernie Sanders Said During Night 2 of the Democratic Debate in Miami,"Listen to everything Bernie Sanders said during the second night of the Democratic presidential debates in Miami, FL."
Sanders' Electability Pitch Has a Problem,"Sen. Bernie Sanders (I-Vt.) is less popular among registered voters than the former VP in 8 key 2020 states, including Arizona, Florida, Pennsylvania and North ..."
Keith Ellison endorses Bernie Sanders for president — again,"Washington – Minnesota Attorney General Keith Ellison endorsed Vermont Sen. Bernie Sanders for president on Friday, opting for a close ideological ally over ..."
"Bernie Sanders, in Cincinnati, Ohio, makes appeal to black Americans; calls out Trump","A day after the Democratic debates, presidential candidate and U.S. Sen. Bernie Sanders courted the vote of black Americans in Cincinnati."
Bernie Sanders says Trump is a 'corporate socialist',"During an interview with CNN's Anderson Cooper, Democratic presidential candidate Bernie Sanders makes his case for why he believes President Donald ..."
Community Voices — Bernie Sanders to California Dems,Transcript of Sen. Bernie Sanders' speech at the California Democratic Convention June 2. Let me thank the California Democratic Party for helping to make this ...
Bernie Sanders To Speak At Black Press Meeting In Cincinnati,Democratic presidential contender Sen. Bernie Sanders will be the featured speaker at a black press convention that begins Tuesday evening in Cincinnati.
Forget Bernie vs. Warren. Focus on Growing the Progressive Base,The last thing we need is for the two strongest progressive candidates and their supporters to tear each other apart.
Would Joe Biden or Bernie Sanders Be a Better Candidate Against Trump?,Senator Bernie Sanders (I-Vt.) supporters insist that not only was their candidate more popular with voters than Hillary Clinton in head-to-head matchups against ...
Sanders: US is more ready to elect a Democratic socialist,2020 Democratic presidential candidate Sen. Bernie Sanders makes the case for why the United States is ready to elect a Democratic socialist president.
How to take on Bernie Sanders on Medicare-for-all,"Sen. Bernie Sanders (I-Vt.), who champions Medicare-for-all, will face nine fellow candidates for the Democratic presidential nomination next Thursday on the ..."
Bernie Sanders campaign video on poverty in the South highlights Lowndes County,Sen. Bernie Sanders' presidential campaign put a spotlight on structural poverty in the South by releasing video Tuesday of Sanders' visit to Lowndes County.
"Bernie Sanders and other Democrats are embracing free college. Europe shows it can be done, but there’s a cost.","AACHEN, Germany — Alexandra Decker is close to earning her engineering degree at a top German university. She's had a good run. She's finishing a ..."
"Bernie Sanders Burns Trump on Iran Strike: ‘It’s Like Setting a Fire, Then Putting It Out’",Democratic presidential candidate Sen. Bernie Sanders (I-VT) was decidedly not impressed with President Donald Trump's decision to call for a military strike on ...
Meet the 2020 Democratic presidential candidate Bernie Sanders,"Bernie Sanders has spent his professional lifetime promoting the progressive cause. The 77-year-old hopes that in 2020, his message has sunk in so deeply ..."
Bernie Sanders used 2020 email list to warn immigrants about ICE raids,"Hours before Trump was set to send out the ""deportation forces,"" Sanders's campaign sent thousands of supporters a distress signal."
Bernie Sanders tells San Jose rally he’ll stand up to the 1 percent,Sen. Bernie Sanders told a crowd in San Jose Saturday night that he's the only Democratic presidential candidate who can break the grip America's top 1 ...
Bernie Sanders Is Selling a Socialist Fantasy,A listener to his speech would never know that socialism has gone wrong or that capitalism has done good.
"In First Two Democratic Debates, Two Separate Missions and Bernie Sanders",The opening two Democratic primary debates of the presidential campaign season present dueling goals for the 20 candidates who will grace a Miami stage ...
Vermont Sen. Bernie Sanders to be in Cincinnati on Friday,Bernie Sanders will provide the keynote address Friday for the National Newspaper Publishers Association's dinner at the Westin Hotel downtown.
Sanders on role of private insurance in Medicare for All,"In an exclusive interview with Dana Bash, 2020 Democratic presidential candidate Sen. Bernie Sanders discusses his signature Medicare for All bill."
Bernie Sanders is FDR’s unimaginative echo,A lack of solid planning will make supporters of democratic socialism face facts.
CAMPAIGN 2020: Sanders demotes carbon taxes. Here's what it means for Dems,"When Sen. Bernie Sanders ran for president three years ago, he routinely held up his support for carbon taxes as proof he was more committed to addressing ..."
Bernie Sanders calls immigration surge a 'serious problem' - Business Insider,"Democratic presidential candidate Bernie Sanders said the flow of migrants illegally crossing the US-Mexico border is a ""serious problem."" He clarified that he ..."
Bernie Sanders fires up supporters in Waterloo,WATERLOO -- Presidential candidate Bernie Sanders appealed to voters in Waterloo on Saturday as a new poll showed him trailing former Vice President Joe ...
Bernie Sanders Has The Highest Floor — And It’s Pretty Damn Low,"This is Silver Bulletpoints, the column where we tackle three topics related to the 2020 Democratic primary in 300 words or less."
How Bernie Sanders Could Throw 2020 to Trump,The looming problem for the Democratic Party is that the Berniecrats aren't going to stand down if its voters turn him down again.
Sanders campaign says he will close migrant detention centers if elected,"Move would be the first executive action he would take, says Jane Sanders as 2020 contenders visit Homestead facility in Florida."
"Bernie and the Terrible, Horrible, No Good, Very Bad Idea - AAF",College debt cancellation sounds great right? Douglas Holtz-Eakin offers his criticism of the Bernie Sanders plan for student debt.
Meet the teens who love Bernie,Roxie Richner is picking at a California roll with her chopsticks and trying to describe Bernie Sanders's 1980s cable-access television show to a friend. “It's like ...
Bernie Sanders launches Twitch channel,The senator is one of the first presidential candidates with a presence on the video game streaming *service*.
Centrist Democrats are spooked by Bernie,"CHARLESTON, S.C. — As President Trump fixates on former Vice President Joe Biden as his opponent in the 2020 general election, some moderate Democrats ..."
Ending America’s Endless War,"We need a foreign policy that focuses on core U.S. interests, clarifies our commitment to democratic values both at home and abroad, and that privileges ..."
25% of Bernie Sanders' supporters don't trust a DNC-run primary - Business Insider,"Democrats who support 2020 candidates Rep. Tulsi Gabbard, entrepreneur Andrew Yang, and Sen. Bernie Sanders find the DNC particularly untrustworthy."
How Bernie Sanders' Position On Gun Control Has Evolved Over Time,"Many of Vermont Sen. Bernie Sanders' policy positions have stayed remarkably consistent throughout his decades in politics, but his position on gun control has ..."
Senator Bernie Sanders Speaks to Thousands of Supporters at San Jose Rally,"Thousands of Bernie Sanders supporters gathered at San Jose's Arena Green Park on Saturday, June 1 to listen to the presidential hopeful speak on issues he."
"Bernie Sanders misdiagnoses America’s problems, proposes wrong solutions","“If there was ever a moment where we had to effectively analyze the competing political and social forces which define this historical period, this is that time,” ..."
Bernie Sanders open to decriminalizing sex work | TheHill,Democratic presidential candidate and Vermont Sen. Bernie Sanders (I) would consider decriminalizing sex work if elected in 2020.
Bernie Sanders Is Exactly Right About Trump’s Saber Rattling on Iran,"In a remarkable exchange, the senator rejects the notion that a “limited strike” on Iran is anything less than “an act of warfare” that could lead to catastrophe."
Bernie Sanders applauds the gaming industry’s push for unionization,"For the past few years, game developers have increasingly sought to unionize amid growing concerns over layoffs and burnout in the industry — and, today, ..."
"Bernie Sanders’ campaign plans bash, college stop during South Carolina trip","Presidential hopeful Sen. Bernie Sanders will be making stops in Columbia and Rock Hill, South Carolina while attending the state's Democratic Party ..."
Alexandria Ocasio-Cortez dangles 2020 endorsement: Bernie Sanders or Elizabeth Warren?,"Alexandria Ocasio-Cortez, a Democratic rising star, could make a key endorsement in the 2020 primary. She's torn between Bernie Sanders and Elizabeth ..."
"For Bernie Sanders, the path to power began Halloween night in a public-housing laundry room","Marc Fisher talks about the only executive office Bernie Sanders has held: mayor of Burlington, Vt. Anna Fifield on her new book, “The Great Successor,” ..."
Stickin' to His Guns? The NRA Helped Elect Bernie Sanders to Congress. Now He's Telling a Different Story.,"Four hours after a former city worker gunned down 12 people at the Virginia Beach Municipal Center last month, Sen. Bernie Sanders (I-Vt.) took to Twitter to call ..."
Bernie Sanders to Mitch McConnell: 'You've got 18 months left',Sen. Bernie Sanders in a Twitter post Tuesday ripped Sen. Mitch McConnell over an op-ed in which he said 'socialist schemes' won't work in America.
Bernie Sanders: ‘Taxes Will Go Up’ to Pay for Medicare for All,Vermont Sen. Bernie Sanders of Vermont says that taxes will go up to pay for his Medicare for All plan on the second night of the Democratic Debate.
Stanley Druckenmiller says stocks would fall 30% to 40% if Bernie Sanders is elected president,"""The good news is we'd all be much more equal because everybody would be poorer, but the rich would have lost a lot more wealth,"" Druckenmiller says."
Fact-checking Bernie Sanders' criticism of JPMorgan CEO Jamie Dimon,"Bernie Sanders went after JPMorgan CEO Jamie Dimon on Twitter Wednesday, suggesting he is a hypocrite for deriding socialism considering the billions of ..."
"Education giveaways: Sanders, Warren plans are full of holes",The senators are addressing the student debt issue in a vacuum.
Sanders: I'll absolutely call Trump a racist to his face,"During an interview with CNN's Anderson Cooper, Democratic presidential candidate Sen. Bernie Sanders said he is ""absolutely"" prepared to call President ..."
Did Bernie Sanders ‘consistently’ vote against the Hyde Amendment?,He says he has always voted against efforts to deny public funding for abortions. But he has voted for spending bills that deny such funds.
Bernie Sanders Unveils New Legislation to Cancel All Student Debt,Vermont Senator Bernier Sanders unveiled new legislation Monday that would wipe out student debt within six months.
Sanders to propose bill wiping student debt of 45M Americans,Democratic presidential candidate Sen. Bernie Sanders (I-Vt.) is set to unveil on Monday legislation to eliminate all $1.6 trillion of student debt held in the U.S. ...
Where Does Bernie Sanders Stand On Student Loan Debt?,Sanders supports debt-free college. But what about current student loan borrowers?
Campaign Conventional Wisdom Is Dead,"Bloomberg's Jonathan Bernstein just published a new piece called, “Is Bernie Finished?” Citing Iowa poll numbers that show poor Sanders “essentially in a ..."
Danny Glover campaigns for Bernie Sanders in Aiken,Your browser does not currently recognize any of the video formats available. Click here to visit our frequently asked questions about HTML5 video.

Bernie Sanders hasn't changed. Is that his strength or a weakness?,"After breakfast on a recent Saturday, Robert Fraass crossed the river from Omaha to this southwest corner of Iowa to catch Bernie Sanders at the opening of his ..."
Bernie Sanders ‘Wrote the Damn Bill.’ Everyone Else Is Just Fighting About It.,"Bernie Sanders was at it again — center stage, his baritone building to something — right hand raised and restless, as if he were scribbling his words on an ..."
Bernie Sanders' ideas are shaping the 2020 debate – but is he still a force?,The diverse Democratic field is a contrast from 2016 but the leftwing firebrand believes Medicare for All can dent his rivals' hopes. by Lauren Gambino in ...
Why Sanders Wanted His Meeting With a Rabbi Kept Secret,Bernie Sanders's advisers and allies want him to get personal with voters as he struggles in the 2020 race. But that isn't his style.
Outsider or Insider? How Bernie Sanders Learned to Walk the Line,"Mr. Sanders was met with scorn when he arrived on Capitol Hill in 1990. But in the years since, he has evolved from a gadfly to a reliable team player."
"Sanders campaign: Media ‘find Bernie annoying, discount his seriousness’","If Bernie Sanders' team had its way, every reporter covering the Vermont senator would put out a tweet disclosing their unvarnished, personal feelings about the ..."
Sanders to Ryan on healthcare: I wrote the damn bill,"During CNN's 2020 Democratic primary debate in Detroit, Senator Bernie Sanders and Senator Tim Ryan argue the benefits under ""Medicare for All"" compared ..."
Bernie Sanders 2020 is in big trouble,Vermont Sen. Bernie Sanders' presidential campaign is in trouble.
Bernie Sanders Heads to Canada for Affordable Insulin,The senator took people with diabetes on a bus trip across the border to dramatize high prices in the U.S. that he attributes to corporate greed.
"Bernie Sanders Raises $18 Million in 3 Months, Trailing Buttigieg","Mr. Sanders's fund-raising has slowed since he began his campaign, though his second-quarter total is still likely to be among the largest in the field."
Bernie Sanders defends staff compensation after complaints his campaign isn't paying $15 an hour,"""It does bother me that people are going outside of the process and going to the media,"" Bernie Sanders told the Des Moines Register. ""That is really not ..."
Bernie Sanders hits back at 'Medicare for All' critics in speech,"Senator Bernie Sanders defended his proposal to provide Medicare to all Americans in a speech on Wednesday, rebutting critics like former Vice President Joe ..."
Exclusive: Bernie Sanders details plan to support American seniors ahead of Iowa appearance,"U.S. Sen. Bernie Sanders detailed his plan to aid American seniors Friday, arguing that expanding Social Security and enacting his signature ""Medicare for All"" ..."
"Bernie Sanders says he would ‘absolutely’ try to break up Facebook, Google, Amazon","Sen. Bernie Sanders (I-Vt.) today said that if elected president he would “absolutely” look to break up online giants Facebook, Google and Amazon, offering his ..."
Bad news for Bernie has his backers getting antsy,"Bernie Sanders keeps getting bad news. After Kamala Harris and Elizabeth Warren seized the spotlight in the first primary debate, the Vermont senator dropped ..."
Bernie Sanders might be losing his N.H. firewall,"Bernie Sanders and his aides would be forgiven if, when mapping out his 2020 presidential campaign, they didn't spend a lot of time wondering how the ..."
Cardi B and Bernie Sanders team up for 2020 campaign to ‘transform country’,It might not seem the most obvious political partnership – a Democratic socialist senator from Vermont and a Bronx rapper – but presidential candidate Bernie ...
Antiwar candidate Bernie Sanders faces backlash over the $1.2 trillion war machine he brought to Vermont,"Bernie Sanders is one of the officials that brought Lockheed Martin's F-35 fighter jet to Vermont. Now the jet is nuclear-capable, and citizens, companies and ..."
Bernie Sanders facing tougher 2020 competition for liberal support,"Barbara Lee supported Bernie Sanders' 2016 presidential bid, helping him score one of his most decisive victories that year when he dominated the New ..."
Bernie Sanders at Democratic debate: 'I wrote the damn bill',"When challenged on the details of his healthcare plan, Medicare for All, the Vermont senator shot back."
Bernie Sanders compared Baltimore to 'third world country' in old clip - Business Insider,"In 2015, Bernie Sanders compared parts of Baltimore to a Third World country. The Trump campaign wants you to think that's on par with his tweets."
Sen. Bernie Sanders on the health-care industry,"“Tonight in America as we speak, 87 million Americans uninsured or underinsured but the health-care industry made $100 billion in profits last year.” –Sen."
Former Bernie Sanders staffer files charge alleging retaliation for union activities,An unnamed individual filed a charge with the National Labor Relations Board alleging that Sen. Bernie Sanders' presidential campaign violated labor laws by ...
"Cardi B’s support for Bernie Sanders, explained","If you think Cardi B just got into politics, you haven't been paying attention."
"Hickenlooper to Sanders: Go ahead, throw your hands up","During CNN's 2020 Democratic primary debate, Sen. Bernie Sanders (I-VT) and former Colorado Gov. John Hickenlooper spar over whether Sanders is too ..."
"Age Isn't Everything, Says Bernie Sanders. 'It Is What You Stand For'",One of Vermont Sen. Bernie Sanders's most animated moments in Thursday night's Democratic debate came after California Rep. Eric Swalwell urged.
The expat crew campaigning for Bernie Sanders in France,A handful of progressive activists wants to deliver the overseas vote to the Vermont senator. Can they keep the caucus together?
'I wrote the damn bill!' Sanders and Ryan tussle in Democratic debate - Business Insider,"Healthcare was one of the key topics debated by Democrats Tuesday, which saw a face-off between Rep. Tim Ryan and Sen. Bernie Sanders."
Campaign co-chair touts 'Gospel of Bernie Sanders',"MULLINS, S.C. – The Democratic Party is preaching the Gospel of Bernie Sanders, according to the co-chair of his 2020 presidential campaign."
Bernie Sanders to propose $20 billion bailout fund for struggling hospitals,"Sen. Bernie Sanders, while wading in to a local fight over a Philadelphia hospital, proposed Monday a plan to create a federal fund to help local governments ..."
Bernie Sanders makes reinstating net neutrality a campaign promise,"Senator Bernie Sanders (I-VT) has made reinstating net neutrality via FCC appointments one of his campaign promises, the Daily Dot reported today. He is far ..."
Bernie Sanders leads caravan into Canada to purchase cheaper insulin with American prices rising,"Windsor, Ontario (CNN) The Democratic primary campaign trail took a detour north of the border Sunday, when Vermont Sen. Bernie Sanders led a group of ..."
Bernie Sanders accepted pharma executives' donations prior to new pledge,Bernie Sanders called on his fellow Democratic presidential candidates Wednesday to reject donations from health insurance and pharmaceutical industry ...
Bernie Sanders: 'Not happy' I voted for 'terrible' 1994 crime bill,"Sen. Bernie Sanders said Sunday he is ""not happy"" he voted for the 1994 crime bill."
Bernie Sanders begins debate with a fight: You're wrong,"During CNN's 2020 Democratic primary debate in Detroit, Sen. Bernie Sanders (I-VT) spars with former Rep. John Delaney over ""Medicare for All."""
On The Trail With Bernie Sanders,"In an ongoing series, the NPR Politics Podcast is hitting the road and interviewing 2020 Democratic presidential candidates. In this episode, Scott Detrow and ..."
Hoping for a Warren-Sanders clash? Their campaigns say don't hold your breath,Progressives are determined to lift either Sen. Bernie Sanders or Sen. Elizabeth Warren to the Democratic presidential nomination next year.
Sen. Bernie Sanders: Idea Of Generational Change Is A 'Pretty Superficial Argument',Presidential hopeful Bernie Sanders says he doesn't think age should be a determining factor in the 2020 race. Sanders spoke with NPR about some of his ...
Fact-checking Bernie Sanders' gun record claims at Democratic debate - Business Insider,"Bernie Sanders' votes on major pieces of gun legislation include one against 1993's Brady Bill, which imposed a waiting period and background checks."
Bernie Sanders Learns A Small Business Lesson,"Minimum wage increase laws typically focus on hourly pay, but not on other elements of an employee's compensation package. For instance, an employer who ..."
Bernie Sanders’ Debate Performance May Have Helped Sell ‘Medicare for All’ to Voters,"According to a CNN poll conducted just after the debates, Democrats and Democratic-leaning independents see Bernie Sanders as the candidate strongest on ..."
Inside Bernie Sanders’ bid to retake New Hampshire,"Joe Caiazzo, New Hampshire state director for the Sanders campaign addresses 20 supporters at the Unitarian Universalist Church in Keene, New Hampshire, ..."
Canada to Bernie Sanders: Don't take our drugs home,Sen. Bernie Sanders wants to lower American drug prices by importing medication from countries like Canada.
"Sanders' early life in Brooklyn taught lessons, some tough","NEW YORK (AP) — Back on Brooklyn College's red brick campus this winter to launch his second bid for the White House, Bernie Sanders set aside rhetoric for ..."
Bernie Sanders Sticks to 2016 Script for 2020,Democratic presidential contender Bernie Sanders said Sunday he won't change his themes for the 2020 campaign even though critics dismiss them as stale or ...
Bernie Sanders to join people with type 1 diabetes on Canada trip for cheaper insulin,Vermont Sen. Bernie Sanders will travel to Canada later this month with Type 1 diabetes patients seeking cheaper insulin as part of his ongoing efforts to ...
Amazon vs. Bernie Sanders battle continues as company calls out senator over warehouse debate,The Amazon vs. Bernie Sanders battle continued Tuesday as the Seattle tech giant fired back again on the topic of worker treatment. Activists around the world…
Bernie Sanders fundraises in downtown Detroit,"WXYZ — Days before the Democratic debates in Detroit, U.S. Senator from Vermont and presidential candidate Bernie Sanders hosted a fundraising event ..."
Alexandria Ocasio-Cortez and Bernie Sanders hit back at Biden for questioning progressive agenda,Rep. Alexandria Ocasio-Cortez thanked Sen. Bernie Sanders for coming to her defense on Friday after former Vice President Joe Biden told CNN that she did ...
Sen. Bernie Sanders talks his 2020 campaign,"Senator and 2020 Presidential Candidate Bernie Sanders joins Andrea Mitchell to discuss his position on Labor Secretary Alex Acosta, working with Alexandria ..."
Bernie Sanders rallies supporters in Santa Monica,Part of Santa Monica turned into Bernie Sanders country Friday as hundreds of supporters lined up to to hear the Vermont senator talk about his proposals.
Bernie Sanders is the gold standard in 2020,Don't be so quick to dismiss Sen. Bernie Sanders in the race to replace the current occupant of the White House.
"Sanders doubles down, compares pharmacy execs to murderers","During an interview with CNN's Jake Tapper, 2020 Democratic presidential candidate Sen. Bernie Sanders doubled down on a comment he made at a ..."
Bernie Sanders' campaign manager speaks out on media bias,"The Bernie Sanders campaign is about ""taking on established power,"" including the media, campaign manager Faiz Shakir tells Brian Stelter. Shakir and Stelter ..."
Elizabeth Warren outraises Bernie Sanders with $19 million haul in 2nd quarter,"Sen. Elizabeth Warren's presidential campaign announced Monday that it raised a total of $19.1 million in the second quarter, more than three times the amount ..."
Bernie Sanders Weighs in on Mueller Hearings and A$AP Rocky,"Presidential candidate Bernie Sanders appeared as a guest on 'Jimmy Kimmel Live', where he discussed the Mueller investigation and his campaign's push for ..."
"Bernie Sanders: As a child, rent control kept a roof over my head","Sen. Bernie Sanders writes that a rent-controlled apartment gave his family a small but crucial sense of economic security, and because of that, he is proposing ..."
Play of the Day: Bernie Sanders Is Here To Yell At You About Health Care,"CNN held the first of two July Democratic primary debates on Tuesday night, going up against the Bachlorette season finale. The Tonight Show's Jimmy Fallon ..."
Bernie Sanders to return donations that violate pledge on private insurance and pharma money,"After calling on his 2020 Democratic opponents to reject money from insurance and drug companies, Sen. Bernie Sanders will return donations he received that ..."
