title,media
A parody website with embarrassing photos of Joe Biden is outranking his official campaign page on Google,Users are reporting that the former vice president's official 2020 campaign page is nowhere to be found on the first page of results for the search term “Joe Biden.
Biden's strength fueled by perception of his electability,"COLUMBIA, S.C. (AP) — Twenty of his rivals have lined up to run for president, believing the race for the Democratic Party's presidential nomination was wide ..."
Joe Biden: Can Obama's vice-president stay the Democratic frontrunner?,"It's been four weeks since Joe Biden announced he was running for president. Since then, in defiance of what was conventional wisdom, he's risen in the polls, ..."
Joe Biden gives pitch on uniting the country in Philadelphia,"Former Vice President Joe Biden made his pitch to unite the country in Philadelphia on Saturday, for the third and final phase of his presidential campaign roll ..."
"Trump says Biden ‘deserted’ Pennsylvania. In Scranton, he’s a ‘hometown boy.’","Over the years, Biden has frequently referenced his Scranton roots, which pundits see as a strategic political move geared to appeal to working-class voters in a ..."
Joe Biden’s campaign of limited exposure: How long can he keep it up?,The former vice president is holding far fewer public sessions than his rivals. Events may make that hard to sustain.
"‘There He Goes Again’? Not Yet, as Biden Avoids Major Gaffes","With aides enveloping him, Mr. Biden has not blurted anything out that delights his rivals or reinforces his image as America's there-he-goes-again relative."
Joe Biden's Restoration Campaign,The former vice president wants to win on a backward-looking platform.
Joe Biden: Breaking up Facebook deserves 'really hard look',"Former Vice President Joe Biden said Monday in an interview with The Associated Press that breaking up Facebook is ""something we should take a really hard ..."
Why is Joe Biden running away with the Democratic presidential nomination?,"Like many political observers, I was more than a little surprised when former Vice President Joe Biden's campaign for the Democratic presidential nomination ..."
How Joe Biden worked with and praised a longtime opponent of civil rights,"In August 1985, 42-year-old Delaware Sen. Joe Biden was preparing for his first presidential bid. Courting southern support, Biden traveled to Mississippi to ..."
Joe Biden Would Be a Disaster,Mehdi Hasan and Rebecca Traister discuss the trouble with “Uncle Joe.”
Joe Biden once said a fence was needed to stop 'tons' of drugs from Mexico,"Joe Biden once spoke about jailing employers who hire ""illegals,"" said sanctuary cities shouldn't be allowed to violate federal law, and argued a fence was ..."
How liberal was Joe Biden?,"The former vice president says he was ""always labeled as one of the most liberal members of the United States Congress."" It depends on how you measure it."
Joe Biden is the front-runner by every measure — except big crowds,"He's dominating in the polls, his fundraising is going gangbusters and he's showing broad support from key political players in the early presidential states."
"Joe Biden Debuts Education Plan, Then Touts It to Teachers’ Union","Mr. Biden promoted the plan, the first policy of his campaign, at a town-hall event with the American Federation of Teachers in Houston on Tuesday."
Joe Biden brings in massive cash haul at Hollywood fundraiser that draws donors from across the country,"Joe Biden raked in over $700000 on Wednesday at a Hollywood fundraiser, one of the biggest hauls so far in the former vice president's campaign to take on ..."
'He's going to have to earn it': Can Joe Biden hold on to his place as Democratic front-runner?,"Joe Biden promises in nearly every speech he makes that ""no one is going to work harder"" to earn votes in the race for the 2020 Democratic presidential ..."
"As Biden Rakes In Big Money, Will There Be a Political Cost?","While some of the 2020 Democrats have sworn off big donors, Joe Biden and his campaign have welcomed them into the fold."
Joe Biden Has Support From Older Black Voters. Is It Enough?,"Mr. Biden is the early pacesetter in the South Carolina primary, buoyed by his long ties to elected officials there. But some question whether his support will ..."
Why isn’t Joe Biden at the California Democratic convention?,"While most of the Democratic candidates for president will be in San Francisco this weekend for the state party convention, Joe Biden, the early front-runner, ..."
Joe Biden’s surprising early strength,"Joe Biden is emerging as a human Treasury bond in a time of turmoil. That is, the favored instrument for nervous political investors searching for safety in an ..."
North Korea slams Joe Biden as a 'fool of low IQ',"SEOUL, South Korea — North Korea has labeled Joe Biden a ""fool of low IQ"" and an ""imbecile bereft of elementary quality as a human being"" after the U.S. ..."
A decades-old feud looms over Biden and Warren in 2020,Joe Biden stormed into the Democratic primary with a laser focus on the man he wants to sweep out of the White House next year.
Joe Biden Gets B on Climate Change from Greenpeace,Joe Biden got a B on a climate change report card ranking Democratic presidential candidates released by the liberal environmental group Greenpeace.
Joe Biden would be a disaster for climate change,The Democratic contender for president provided details of his climate plan and it boils down to: business as usual.
Biden Faces Conflict of Interest Questions That Are Being Promoted by Trump and Allies,"As vice president, Joe Biden played a key role in the dismissal of a Ukrainian prosecutor who had opened an investigation of a company employing Mr. Biden's ..."
"Biden goes light on policy, heavy on emotion","The former veep shows signs of rust in Iowa, but his supporters don't mind."
Biden plots an early kill,"Joe Biden is trying to snuff out his Democratic competitors before the race really gets going. Why it matters: By all accounts, Biden's strategy is working — even ..."
Why Joe Biden Is the Only True Progressive Candidate,"As the beneficiary of simultaneous attacks by both President Donald Trump from the right and Representative Alexandria Ocasio-Cortez from the left, former Vice ..."
'They don’t make 'em like Joe anymore': Biden expands grip on congressional endorsements,"Former Vice President Joe Biden expanded his lead in congressional endorsements Thursday, landing the backing of second-term Rep. Al Lawson of Florida."
"Four Years After Beau Biden’s Death, His Father Bonds With Voters in Pain","As Joe Biden runs for president, there is evidence that his family tragedies have helped him form connections with voters grappling with their own grief."
"As Biden predicts a shorter race, rivals dig in for long fight","WASHINGTON — Slow your roll, Joe. That's the message several of former Vice President Joe Biden's rivals for the Democratic presidential nomination are ..."
Joe Biden wants us to forget his past. We won't,"As times have changed, Biden's expressed retrospective misgivings about some of his earlier actions and stances. That's not enough."
Joe Jokes: Roundup of Joe Biden late night jokes about his 2020 presidential run,"With Joe Biden running for the 2020 Democratic presidential nomination, we scour late night talk shows and the entertainment world for Biden-related humor in ..."
Teflon Joe? Biden brushes off attacks | TheHill,"One month into his presidential run, former Vice President Joe Biden is topping national polls while showing a Teflon-like quality to survive criticism lobbed ..."
Biden represents the best and worst of his generation,"Biden's persona appeals to the sensibilities of an elder generation and the character traits they admire. This identity is a big part of Biden's pitch, but he also ..."
Special-Interest Money Is Still Rolling Into Joe Biden's PAC,"In his bid to become the Democratic presidential nominee, former Vice President Joe Biden pledged to reject contributions from lobbyists and corporate PACs."
North Korea calls Biden 'fool of low IQ' over Kim criticism,"SEOUL, South Korea (AP) — North Korea has labeled Joe Biden a ""fool of low IQ"" and an ""imbecile bereft of elementary quality as a human being"" after the U.S. ..."
Fact-checking Biden's claim the '94 crime bill didn't cause mass incarceration,"During a campaign event in Nashua, New Hampshire on Tuesday, Democratic presidential frontrunner Joe Biden was asked about the 1994 crime bill he ..."
Joe Biden wins support of NH man he insulted in 1987,A Granite Stater who Joe Biden insulted while on the campaign trail in 1987 said he's 100 percent behind the former vice president's 2020 bid for the White ...
"Ocasio-Cortez attacks Biden on climate change policy, Biden says he's 'never been middle of the road'","Rep. Alexandria Ocasio-Cortez goes after Former Vice President Joe Biden, although not by name, on his reported ""middle ground"" climate change policy."
Democrats itching to take down Biden over free-trade past,Joe Biden's campaign kickoff was designed to showcase his blue-collar appeal: A rally at a Teamsters hall in Pittsburgh where he railed against Wall Street and ...
Was Joe Biden a climate change pioneer in Congress? History says yes,"Joe Biden may not be the most progressive candidate in the crowded Democratic primary field. But one thing is for certain: Among 2020 presidential candidates, ..."
"Biden: Congress should protect abortion rights, if necessary","WASHINGTON (AP) — Joe Biden would support Congress enshrining abortion rights into federal law ""should it become necessary,"" his presidential campaign ..."
Joe Biden's Audacity of Grief,On the mournful threads connecting his half-century in politics.
Joe Biden reflects on loss of son Beau at Memorial Day service in Delaware,"Joe Biden returned home to Delaware on Thursday, where he spoke at a veterans Memorial Day *service* in New Castle."
Cable News Is Covering Biden As Much As Every Other Democratic Candidate Combined,"In the first full week of his 2020 campaign, former Vice President Joe Biden continued to dominate cable news coverage on CNN, Fox News and MSNBC."
Joe Biden's campaign responds to North Korea criticizing him using Trump's 'low IQ' individual insult,North Korea issued a list of criticisms against former Vice President Joe Biden after he criticized Kim Jong Un on the campaign trail.
Joe Biden Hauls In Nearly $800K From A-Lister Hollywood Fundraiser Last Night – Update,The former VP pulled in a crowd of around 300 well-heeled donors for his first Hollywood fundraiser of the 2020 campaign.
Trump: Discussing a Biden probe with Barr would be 'appropriate',President Donald Trump told POLITICO on Friday that it would be “appropriate” for him to speak to Attorney General Bill Barr about launching an investigation ...
Republican Conspiracy Theory About a Biden Scandal in Ukraine Is “Absolute Nonsense”,"The rumor that Joe Biden abused his power to protect his son's business interests in Ukraine is “absolute nonsense,” leading anti-corruption activist says."
How Joe Biden is eating into Bernie Sanders' coalition,"Since officially jumping into the 2020 race less than two weeks ago, former Vice President Joe Biden has reshaped the Democratic primary. His polling numbers ..."
Joe Biden and the Dixiecrats Who Helped His Career,"Vice President Joe Biden talked about his mentor James O. Eastland at a rally for Democrat Doug Jones in Birmingham, Ala., in 2017."
Trump attacks potential 2020 rival Joe Biden in market-moving tweets about China trade negotiations,Trump's Tweets on China show his attention is on Democratic 2020 front-runner Joe Biden even as he prepares for the most crucial trade talks of his presidency.
Here's How Deep Biden's Busing Problem Runs,"In the summer of 1974, the freshman Senator Joe Biden found himself under siege from white suburbanites at a meeting just south of Wilmington, Del."
Why the alleged Joe Biden ‘Ukraine conspiracy’ doesn’t hold up,Rudy Giuliani didn't bother to look into the details before accusing the former vice president of untoward behavior.
California health care union protests Joe Biden fundraiser,A health care union in California held a protest at a fundraiser for Joe Biden held at the home of a board member for Kaiser Permanente in Los Angeles ...
Why Joe Biden Isn't the Best Alternative to Trump,I don't dislike Joe Biden. He is reportedly a very decent man. I remember very fondly his friendship with Obama. Remember those memes about their friendship?
"Joe Biden eyes San Francisco fundraising tour, setting up a Bay Area battleground for 2020 Democratic dollars",Biden is getting ready to head to California's Bay Area for a fundraising tour that will include stops in San Francisco and Silicon Valley.
That Time Joe Biden Lied About His Academic Credentials – Mother Jones,"A commenter at the wonderful blog Lawyers, Guns, and Money dug up this C-SPAN video of Joe Biden lying about his academic credentials in 1987."
America’s Soul Is Not on the Ballot,"The United States will require much correction in the wake of Donald Trump, should he be defeated and should he actually leave the presidency peacefully."
They worked for Obama. They’re not supporting Biden — yet.,"As Joe Biden seeks Barack Obama's third term, many of the former president's loyalists wait to see 'who lights a fire'."
"Fact-checking Joe Biden, Hunter Biden, and Ukraine","Editor's Note, Sept. 23, 2019: This story was first published May 9, 2019; we have since published additional coverage that incorporates new developments here ..."
The evolution of Joe Biden,The issues that hurt Joe Biden in his last presidential race are helping him today.
Jimmy Kimmel Predicts Biden Won’t Sell Many ‘MAMA’ Hats,"'Make America Moral Again' is a nice sentiment, but it is an absolutely terrible hat,” Jimmy Kimmel said of Joe Biden's answer to the Trump slogan."
"14 Years Ago, Warren And Biden Battled Over Bankruptcy. Their Fight Still Defines A Party Rift","In 2005, then-Sen. Biden, along with most Republicans, favored an effort to make it more difficult to file for bankruptcy. Professor Warren opposed the bill."
Trump: Biden probably is a low-IQ individual,President Trump takes a swipe at former Vice President Joe Biden during a press conference with Japanese Prime Minister Shinzo Abe.
Biden jokes he's only 'real Irishman' running for president. Delaney searches for 'civil' response,"WASHINGTON – Former Vice President Joe Biden's assertion that he is the only ""real Irishman"" running for president has led a fellow candidate to suggest they ..."
Report: Joe Biden Picks Philadelphia's Centre Square For Presidential Campaign Headquarters,"Joe Biden has chosen to run his 2020 presidential campaign out of Philadelphia, and reportedly will do so at an office across the street from City Hall."
Does Joe Biden Have a #MeToo Problem?,"Last week, former Vice-President Joe Biden announced his candidacy for the 2020 Presidential race. He has an early lead in polls, but several women have ..."
Did US Presidential Candidate Joe Biden Say He Had 'No Empathy' for the Plight of Younger People?,A January 2018 video of the former U.S. vice president re-emerged in May 2019 after he announced his candidacy for president.
Joe Biden Isn't Too Soft on America,"Joe Biden's entry into the race for the Democratic presidential nomination has opened up a division in the party, and it's not just about the candidates' ..."
Fact-checking Joe Biden's claims on Trump's tax cuts,"CNN's Jake Tapper, in partnership with FactCheck.org, looks at Joe Biden's claim that ""all of"" Trump's tax cuts ""went to folks at the top and corporations that paid ..."
Joe Biden prepares for New York fundraising blitz with Gov. Andrew Cuomo and short seller Jim Chanos,"Former Vice President Joe Biden is preparing for a June fundraising blitz in New York, where he will be joined by Gov. Andrew Cuomo and the investor Jim ..."
Biden Backs Two Years of “Free” Community College,"Joseph Biden, in his first campaign appearance in New Hampshire as a declared 2020 Democratic presidential candidate, says he would make two years of ..."
Jill Biden Says 'It's Time To Move On' From Anita Hill Controversy,"The wife of 2020 Democratic candidate Joe Biden spoke to NPR about her new book, Where The Light Enters, reflecting on her life with the former vice ..."
"Jill Biden writes of marriage with Joe, 'totally shattering' death of son Beau in new book","Jill Biden's ""Where the Light Enters"" gives insight to her marriage with former vice president Joe, and the crushing death of their son Beau."
There's trouble brewing in Joe Biden's presidential campaign,WASHINGTON — Joe Biden's presidential campaign is in trouble. That may sound crazy. The former vice president just opened up (according to one poll) a ...
Joe Biden's son advised crooked Romanian businessman sentenced for corruption,Former Vice President Joe Biden's son Hunter once worked with a Romanian businessman who was convicted and imprisoned following an investigation over ...
‘Sleepy Joe’ Biden is one of the few US politicians who’s wide awake about China,"When the Obama-era vice-president said China was 'not competition' for the US, the backlash was enough to make him walk back his comments, but the ..."
How Joe Biden’s Policies Made the Opioid Crisis Harder to Treat,"For decades, he promoted the War on Drugs. Now, experts say Biden's laws ended up worsening the opioid epidemic in the very places he says he can win in ..."
Joe Biden Has Called for Social Security Cuts 3 Times,"Although Democrats have long favored raising revenue to fix Social Security, Biden has broken with his party on a few occasions."
Brit Hume: Joe Biden a ‘walking time-bomb’ despite Democratic front-runner status,"Joe Biden might be leading the race for his party's nomination now, but the former vice president is a ""walking time-bomb"" and has to perform a ""high-wire act"" if ..."
Ukraine prosecutor: No evidence of wrongdoing by Biden or his son,"Ukraine's prosecutor general told Bloomberg Thursday that he has no evidence of wrongdoing by former Vice President Joe Biden or his son Hunter Biden, ..."
Biden's downplay of China threat breaks with D.C.'s bipartisan consensus,"Joe Biden yesterday seemed to downplay growing U.S. concerns about China, saying at a campaign stop in Iowa City: China is going to eat our lunch?"
Two presidential candidates have homes in Rehoboth,"Who knows? When Democratic presidential debates are scheduled in the coming months, maybe there will be one at the Henlopen Acres Beach Club."
Ocasio-Cortez takes a veiled shot at Joe Biden,Rep. Alexandria Ocasio-Cortez took a veiled shot at former Vice President Joe Biden's stance on climate change while giving a speech on the Green New Deal.
Biden Maintaining Majority Favorable Rating,"Joe Biden's favorable rating is 53% among all U.S. adults, the highest of seven Democratic presidential candidates measured in the latest Gallup poll."
Joe Biden Won’t Blame the Republicans for Trump. That Should Disqualify Him.,"Biden says Trump is the sole cause of America's political crisis — but in fact, the president is a symptom of the GOP's derangement."
Fact-check: Joe Biden's defense of his 1994 crime bill and mass incarceration,Joe Biden is getting criticism from both sides over the 1994 crime bill. The sprawling $30 billion package included money for drug treatment and community ...
North Korea lashes out at Joe Biden,"North Korean leader Kim Jong Un and his regime are lashing out at 2020 Democratic frontrunner, Joe Biden, calling the former Vice President an ""imbecile"" with ..."
Joe Biden and the Debate Over Apologies,Readers discuss the politics and psychology of saying “I'm sorry.”
Joe Biden is stuck in the past when it comes to climate change,Biden thinks fracked gas is an acceptable way to reduce emissions. He is too stuck in the past to be a credible standard-bearer for the Democratic party.
Joe Biden's frontrunner success shows identity politics aren't moving Democratic voters,"Reports of the death of the Democratic old guard in the face of a ""woke"" Democratic electorate have been greatly exaggerated. Former Vice President Joe Biden ..."
Timeline: A history of the Joe Biden-Anita Hill controversy | TheHill,Joe Biden's presidential campaign launch is putting a new spotlight on the former vice president's handling of Anita Hill's 1991 Senate testimony about alleged ...
Did Joe Biden Publicly Reveal the Identity of the Special-Ops Unit That Killed Bin Laden?,In question are statements the former U.S. vice president made following the raid that killed the mastermind of the 9/11 attacks in the U.S..
Joe Biden Should Retire the Phrase ‘Dignity of Work’,Joe Biden is fond of the phrase “dignity of work.” It isn't just cliché — it also highlights how Biden's own policies have linked human dignity to a rigid view of worth ...
What Cuomo's endorsement of Biden means | CSNY,"Gov. Andrew Cuomo is backing Joseph Biden for president – but why? According to the governor, he believes in Biden because he “can beat Trump” and “can ..."
"In 1989, Joe Biden Believed the Difference Between Marijuana and Alcohol Is That One Can Be Used Responsibly","In video surfaced by Mother Jones, the 2020 hopeful rails against cannabis legalization. His views don't seem to have changed much in the decades since."
