title,media
Will Joe Biden's political record come back to haunt him?,Joe Biden has emerged as the front-runner in the Democratic nomination race to take on President Donald Trump in November's White House election.
"Biden calls for party unification, draws contrast to Trump in quiet victory speech","As Biden's victory speech circulated Tuesday night, viewers called his words presidential, a sign of leadership and a contrast to President Trump's bluster."
Joe Biden's historic and unbelievable political comeback dominates Super Tuesday,"Joe Biden just pulled off the biggest, fastest and most unexpected comeback in modern political history."
5 takeaways from Joe Biden's CNN town hall on the coronavirus response,Joe Biden during a CNN town hall Friday night detailed how he'd respond to the coronavirus pandemic.
Joe Biden's Strategy To Reach Voters On TV And Online,"Often overshadowed online by his rivals, Joe Biden is holding virtual town halls and fundraisers. He's also trying to compete for TV airtime as the country is ..."
"Joe Biden Is Poised to Deliver the Biggest Surprise of 2020: A Short, Orderly Primary",He has such a thorough hold on the party now that any collapse would probably require a political U-turn as sharp as the one that precipitated his rise.
"Democrats Decide That Joe Biden, as Risky as He Ever Was, Is the Safest Bet","The former vice president had the Super Tuesday of his dreams, winning in places he hasn't even set foot in recently."
Joe Biden releases plan to combat coronavirus in effort to show contrast with Trump,Former Vice President Joe Biden released his plan to combat the coronavirus pandemic during an address aimed at demonstrating a contrast with President ...
55 Things You Need to Know About Joe Biden,Joe Biden's life in politics has been marked from its inception by its seismographic lurching from success to setback. Victories were followed by unthinkable ...
Joe Biden's inner circle: No longer a boys club,"Weeks before Joe Biden launched his 2020 presidential campaign, he released a social media video to address allegations from women who said his uninvited ..."
Joe Biden Commits to Selecting a Woman as Vice President,Mr. Biden said for the first time at Sunday's Democratic debate on CNN that he would choose a woman to be his running mate.
The Long Arc of Joe Biden,"Joe Biden's last Democratic rival is all but vanquished. A deadly, invisible virus is sweeping the country. A global recession is looming and no one knows what ..."
Joe Biden Has Had Flimsy Organization. It Hasn’t Hurt Him.,Joseph R. Biden Jr.'s campaign organization in key Super Tuesday states was so flimsy that it shocked and alarmed Democratic Party leaders. Mr. Biden had ...
How winning turned Joe Biden into a confident candidate,"LOS ANGELES (AP) — Joe Biden strode confidently to the podium, shutters clicking, a bank of cameras beaming to a national audience. “Those of you who ..."
"Live broadcasts, online fundraising, one-on-one calls: How the Biden campaign is adjusting its tactics amid the coronavirus","Campaign staffers are hunkered down at home instead of working from their headquarters or in primary states. Traditional fundraisers, campaign rallies and ..."
How Joe Biden bounced back,Los Angeles (CNN) Joe Biden was standing on a stage above a blacktop basketball court just off Obama Boulevard as he watched his path to the Democratic ...
Joe Biden postpones virtual fundraiser until next week following technical difficulties with online town hall,Biden's campaign has moved to virtual events as the coronavirus spreads and people are discouraged to gather together in crowds.
Biden makes pitch as an empathetic leader in new digital ad,"Joe Biden describes the coronavirus crisis as a ""war"" and frontline workers as ""soldiers"" in a new digital ad that will air in battleground states."
Kamala Harris endorses Joe Biden as Democratic presidential candidate,"California Senator Kamala Harris has endorsed Joe Biden with ""great enthusiasm"" as the Democratic party's US presidential candidate. ""Biden has served our ..."
The New Coalition Behind Joe Biden Ahead of Super Tuesday,"The polls on the morning of Super Tuesday showed a staggering reversal in the Democratic race, with the former Vice-President pulling ahead of Bernie ..."
"Enjoy it, Joe Biden, because it won’t last","Former vice president Joe Biden handily won the South Carolina Democratic primary, but take a step back and the victory wasn't nearly as promising as his ..."
Joe Biden campaigns in Texas fresh off his win in South Carolina,"The former vice president received big-name endorsements — including backing from former presidential candidates Beto O'Rourke, Pete Buttigieg and Amy ..."
Joe Biden Will Host ‘Virtual Events’ as Coronavirus Fears Heat Up,The Biden campaign's move to limit in-person campaigning marked the beginning of an extraordinary new chapter in an already tumultuous presidential race: ...
Joe Biden’s first virtual town hall was an absolute technical nightmare,"When I logged onto Joe Biden's first-ever virtual town hall, I was greeted with one Illinois senator adjusting the angle of her webcam and another showing off an ..."
Campaign Foreign Policy Roundup: Will Joe Biden Change His Foreign Policy?,"The Greek philosopher Heraclitus said that “No one ever steps in the same river twice.” His point, at the risk of oversimplification, is that all things change."
Joe Biden Needs to Bulk Up His Team. He’s Hiring a New Campaign Manager.,"WASHINGTON — Former Vice President Joseph R. Biden Jr. announced on Thursday that he had hired Jennifer O'Malley Dillon as his new campaign manager, ..."
Joe Biden gets Secret Service detail as he closes in on the 2020 Democratic nomination,"Discussion of Biden's protection arose earlier this month, when a protester stormed on stage where Biden was delivering a victory speech."
Joe Biden is blowing this campaign in more ways than one,"Joe Biden is in a pickle, a serious one. He's the presumptive presidential nominee of the Democratic Party. But Bernie Sanders, his lone remaining primary ..."
Joe Biden's pledge could change the look of the Supreme Court,"Washington (CNN) In October 1980, when Ronald Reagan's presidential campaign appeared to be lagging, his strategists suggested he appeal to female voters ..."
Joe Biden fundraisers see millions of dollars in new commitments with Super Tuesday surge,Former Vice President Joe Biden went into Super Tuesday with fewer financial resources than other candidates. But he will be in much better shape by the end ...
Joe Biden has pulled off one of the great political comebacks,The former vice-president has run a lousy campaign. He will likely be the Democratic nominee anyway.
The Case For Joe Biden,"Joe Biden treats everyone with the respect and dignity they deserve, writes Alex Bausch, and his long record of legislative experience backs that up."
"Joe Biden raises doubts about whether Democrats will hold convention in July, saying ‘It’s hard to envision that’","Joe Biden raised significant doubts about whether the Democratic National Convention will be held as planned in July, with the likely presidential nominee ..."
Joe Biden Takes Command,The former vice president again won the majority of delegates in Tuesday's primaries. But will his moderate coalition be able to win over Bernie Sanders's ...
Joe Biden has come the closest to reassembling the Obama coalition. He still has work to do,"Biden's surge has been powered by a multiracial swath of Black and suburban voters, women, and Republicans disenchanted with President Trump. But his ..."
"An Apology to Joe Biden, Who Was Clearly the Unbeatable Favorite All Along","Over the past month, you may have read, here and elsewhere, that Joe Biden had about as much of a chance of winning the Democratic presidential nomination ..."
Fact check: Trump and his campaign promote dishonestly edited Biden video,Washington (CNN) President Donald Trump and his campaign promoted a dishonestly edited video on Saturday that wrongly made it seem as if Democratic ...
5 primary takeaways: Joe Biden is Democrats' antidote,"Joe Biden's surge toward the Democratic presidential nomination rolled on with a dominating victory in Florida, the largest delegate prize in Tuesday's primaries, ..."
Two major Democratic groups back Biden with 9-figure campaign,"Two major outside Democratic groups launched a general election partnership to boost Joe Biden's presidential campaign with polling, opposition research and ..."
Joe Biden Has Been Dropping Hints About his VP Pick,Update: Former Vice President Joe Biden committed at the March 15th Democratic debate that his running mate would be a woman. His campaign confirmed the ...
Joe Biden Points to Ebola Experience in Pitching Coronavirus Plan,"Democratic front-runner Joe Biden looks to leverage his Ebola experience against President Trump, casting himself as someone who would be a steady leader ..."
CNN projects Joe Biden wins Michigan primary,CNN projects Democratic presidential candidate and former Vice President Joe Biden will win the 2020 Michigan primary.
"Joe Biden Gives Speech After Wins in Illinois, Florida",Former vice president Joe Biden gives his victory speech Tuesday night after two massive wins against his opponent Bernie Sanders in the Florida and Illinois...
Biden mixes up wife and sister in Super Tuesday speech,Democratic presidential candidate and former Vice President Joe Biden accidentally mixed up his sister and his wife during the opening remarks of his Super ...
Pete Buttigieg endorses Joe Biden,"Washington (CNN) Pete Buttigieg endorsed Joe Biden for president Monday night, telling a crowd in Dallas the former Vice President is the right candidate to ..."
Protesters rush stage as Joe Biden makes Super Tuesday speech – video,"Joe Biden surged to Super Tuesday victories in nine states, sweeping the south and taking the key state of Texas in a remarkable comeback on the most pivotal ..."
Fact check: Joe Biden's comments on gun control,"Former Vice President Joe Biden, who's the current front-runner in the Democratic presidential primary, made several gun-related claims recently during an ..."
"Joe Biden's business allies are pushing Kamala Harris, Amy Klobuchar as potential VP picks","Joe Biden is in the process of narrowing down his list of potential running mates, and his allies in the business community are weighing in with their favorite ..."
Joe Biden campaign announces new coronavirus committee to provide counsel as pandemic fears escalate,Joe Biden's presidential campaign announced on Wednesday that it had formed a new advisory committee to counsel the campaign on the risks posed by the ...
Biden commits to having a woman as vice president,"During the Democratic presidential debate in Washington, former Vice President Joe Biden committed to having a woman be his running mate and appointing a ..."
Partly false claim: Joe Biden lives in the biggest mansion in his state; Bernie Sanders has four houses; Barack Obama just got his third mansion,"Shared over 1,000 times as of March 10, 2020, a photo posted on Facebook here&set=a.3107216972814&type=3&theater claims that Joe Biden lives in the ..."
Sanders supporter: What I trust about Joe Biden,"""I hear you,"" said Joe Biden, and I believe him, author Ariel Dorfman writes. He met the candidate in 2003 at a TV taping about the Iraq war and was touched and ..."
The View From The Joe Biden Camp After Super Tuesday,"NPR's Ari Shapiro speaks with Symone Sanders, senior adviser to Joe Biden's presidential campaign, about the results from Super Tuesday and the path ..."
Joe Biden's secret governing plan,Top advisers see a need to name a woman or African American as vice president.
'We love him': Biden's hometown of Scranton highlights his earthy appeal,"The Scranton store where a young Joe Biden used to buy his candy is still in operation today, a stone's throw from the wood-slatted house where the presidential ..."
Biden surged without much cash — but now it's pouring in,"The old order of big money in politics is fast re-emerging in the Democratic presidential race. But up through Super Tuesday, a lot of big spending did not ..."
Technical trouble spoils Joe Biden's first 'virtual town hall',"Former Vice President Joe Biden's first ""virtual town hall"" was a technical calamity as his campaign confronts the same challenges of unexpected remote work ..."
Why Joe Biden should pick ‘that governor’ to be his running mate,"Former vice president Joe Biden has already announced his plans to pick a female running mate. It's becoming increasingly apparent that “that governor"" should ..."
Are Democrats Cool on Biden?,"Republicans are more excited to vote for President Trump than Democrats are for their likely nominee, polling shows."
Joe Biden’s Super Tuesday Revival,"If Tuesday night's results point toward a broad, national victory for the former Vice-President, then that outcome will be strangely separate from the campaign that ..."
"Joe Biden says his age, mental sharpness are not obstacles to the White House","Joe Biden has mangled quoting the Declaration of Independence, incorrectly said 150 million Americans have been killed by gun violence since 2007, that he is ..."
John King: Joe Biden is running the table,CNN's John King breaks down former Vice President Joe Biden's wins in key primary states open for voting during the coronavirus pandemic.
Trevor Noah Confused By Joe Biden Gaffes: “This Is Not Good”,"Between the constant campaign rallies, debates, fundraisers and media interviews, running for president is obviously grueling. On tonight's installment of The ..."
The Ukraine conversation Joe Biden needs to have,Former vice president Joe Biden's astonishing political success over the past week has felt like a bandwagon for sensible politics. But to keep it rolling toward ...
This one number may explain why Biden won primaries,"CNN political forecaster Harry Enten looks at key numbers in the wake of the Illinois, Florida and Arizona primaries that explain how former Vice President Joe ..."
Joe Biden's character and courage will lead him to win the presidency | Opinion,"After traveling to the primary states, it's increasingly clear to me that Joe Biden has the character, intellect, temperament, and experience to win."
CNN projects Joe Biden will win Alabama,CNN projects former Vice President Joe Biden will win the state of Alabama.
Joe Biden Delivers Speech Criticizing Trump Administration On Coronavirus Response,Democratic presidential candidate Joe Biden gives a speech about coronavirus policy from his home state of Delaware. Here's a recap of what he says.
How Biden’s Victory in Michigan Points to Trouble for Trump in November,"Joseph R. Biden Jr. didn't just win the Michigan primary this week. The turnout and demographic patterns of voters, from African-Americans in Detroit to affluent ..."
Can Joe Biden thrive as a front-runner?,"He's used to running as an underdog, but that could help his front-runner status."
Suburbanites are voting and that's good news for Joe Biden,"BURNSVILLE, Minn. (AP) — Nearly two years after suburbanites helped drive a Democratic surge, there are clear signs these voters are engaged and primed to ..."
Joe Biden spars with Michigan autoworker over guns – video,"Joe Biden, frontrunner for the US Democratic presidential nomination, got into a heated exchange with an autoworker at a campaign stop when questioned ..."
How Joe Biden's campaign is protecting itself from cyber attacks,Philadelphia (CNN) Top tech officials working for Joe Biden's campaign aren't taking any second chances following the 2016 hacking of the Democratic National ...
Is Joe Biden the Future of the Democratic Party?,"Joe Biden's pitch to voters has been remarkably consistent: he says he can unite older voters, people of color, and moderates into a coalition that can defeat ..."
"Biden Promises Pay Raises for Feds, Vows to Rely on Civil Servants' Expertise","Former Vice President Joe Biden has promised to trust the career federal workforce and rely on its expertise, a group he said the Trump administration has ..."
TikTok struggled to remove a deceptively edited clip of Joe Biden - Business Insider,"A viral clip of Joe Biden edited down to him saying ""We can only re-elect Donald Trump"" has been deemed manipulated, misleading, and partly false, by Twitter, ..."
CNN projects Joe Biden will win North Carolina,CNN projects that former Vice President Joe Biden will win North Carolina's Democratic primary.
How Biden Came Back,"As Joe Biden meandered through a speech at the front of an old theater in Manchester, Terry Shumaker, a fixture of New Hampshire politics, walked around with ..."
Why Black voters support Joe Biden,"To be sure, every Democratic candidate has Black supporters. Yet Biden has two advantages."
Biden commits to moratorium on deportations of immigrants,Joe Biden committed to halting deportations of nearly all immigrants in the country illegally. The former vice president said Sunday at the Democratic debate that ...
Chalian: Biden has a 'near insurmountable' delegate lead,"CNN political director David Chalian says given the rate that former Vice President Joe Biden is winning delegates, he would call it ""a near insurmountable lead"" ..."
Biden Looks to Expand Staff as Bloomberg Weighs How to Help Him,"Joseph R. Biden Jr., emboldened by his unexpectedly strong Super Tuesday performance and flush with cash, is moving to hire new aides who he hopes can ..."
Joe Biden vowed to pick a woman for vice president. Why not a Latina?,"Former Vice President Joe Biden said he'd pick a woman as his running mate, and though Latinas have not been among the top names mentioned, it needs to ..."
Joe Biden’s big vision for America: He wants to restore faith in government,"Joe Biden wants voters to trust him as a leader who will help restore America's moral compass. As Sen. Cory Booker, a former rival who has now endorsed ..."
Even moderate Joe Biden would significantly increase taxes on the wealthy if elected,Former Vice President Joe Biden's plan to raise taxes on corporations and wealthy households would increase federal revenue by $4 trillion over the next ...
Joe Biden rally: Protesters interrupt over housing issues,"When Vice President Joe Biden walked out on stage at a campaign rally Saturday evening in front of the WWI Museum and Memorial in Kansas City, Missouri, ..."
‘Am I on Camera?’ Joe Biden’s Foray Into Virtual Campaigning,Technical glitches disrupted Mr. Biden's virtual town hall with voters in Illinois on Friday. Bernie Sanders held an online “fireside chat'' on Saturday. It's the new ...
Joe Biden Can't Be Trusted to Fight for Abortion Rights,"Until last year, Joe Biden supported a law that restricted federal funding for abortion — and his flip-flop smacks of political expediency."
Why Joe Biden Is The Pragmatic Choice For Black Voters,"NPR's David Greene talks to, Theodore R. Johnson, senior fellow at the Brennan Center for Justice, on the political pragmatism of black voters."
Joe Biden's Record on China and Taiwan,"For decades, Biden has embraced the “China engagement” doctrine and warned Taiwan to tread carefully. Now, though, he seems to have changed his tune."
"Joe Biden Campaign Denies Sexual Assault Claims, But Says “Women Have The Right To Tell Their Story”","Joe Biden's campaign has spoken out over graphic sexual assault claims an ex-staffer has made. 'Women have the right to tell their story, and reporters have an ..."
Former Obama fundraising chief calls on over 700 bundlers to back Joe Biden's surging campaign,The architect of President Obama's 2012 fundraising juggernaut has reached out to more than 700 bundlers in a bid to convince them to back Joe Biden's ...
Joe Biden Is Frustrated People Think He Still Believes Marijuana Is A Gateway Drug,The former vice president has in fact called cannabis a gateway drug in the past.
Biden’s promise of a female vice president was a good thing. So why does it feel so lame?,The Democratic front-runner should have announced an actual woman instead of pledging a woman to be named later.
"In Self-Isolation, Biden Launches Media Blitz to Attack Trump Over Virus","Until a few days ago, Democratic presidential front-runner Joe Biden kept a low profile while in protective self-isolation from the coronavirus at his home in ..."
"To stutterers, Joe Biden deserves praise for being in public life","To the editor: As a lifelong stutterer, I totally sympathize with former Vice President Joe Biden and his quick word substitutions or quirky phrasing to overcome a ..."
"Michael Bloomberg Ends Campaign, Endorses Joe Biden",Former New York City Mayor Michael Bloomberg announced he is ending his 2020 Presidential bid and will endorse former Vice President Joe Biden.
Why a Biden-Klobuchar ticket can beat Trump,There's a lot of talk that former vice president Joe Biden should pick a progressive or a person of color for his running mate if he does become the nominee.
I just remembered Joe Biden is fine,"This is a little awkward, but better late than never! I suddenly remembered that Joe Biden is a dynamite candidate, something I had forgotten over the past few ..."
Biden vows to restore decency to the presidency if he wins,"Democratic presidential candidate Joe Biden offered a message of unity after he won the Mississippi, Michigan and Missouri primaries on Super Tuesday II."
